https://vinmart.co/gau-bo-my-st-helens-500g-thai-lat-cuon-s8758512131.html,Gầu bò Mỹ St Helens 500g thái lát cuộn,BEEF HOUSE-Thực phẩm nhập khẩu,159000,Còn hàng,Hà Nội,Giới thiệu Gầu bò Mỹ St Helens 500g thái lát cuộn Gầu bò Mỹ Brisket là sản phẩm nhập khẩu trực tiếp từ thương hiệu thịt bò hàng đầu của Mỹ St Helens với đầy đủ tem nhãn của nhà sản xuất và dấu kiểm định của Bộ Nông Nghiệp Hoa Kỳ USDA ĂN GẦU BÒ CÓ TỐT KHÔNG Chứa nhiều loại axit amin khoáng chất vitamin cần thiết cho mọi hoạt động sống của cơ thể Protein giúp cho người có thể chất yếu ngày càng khỏe mạnh Do đó sử dụng gầu bò Mỹ Brisket Point giúp cải thiện sức đề kháng lâu dài của cơ thể Gầu bò Mỹ là phần thịt lẫn với mỡ gân nằm ở ức của con bò Thịt nằm ở vị trí này rất thơm nhiều mỡ và gân Khi nấu nhừ thì gọi là nạm còn phần vừa nhiều mỡ và gân thì gọi là gàu Mỡ ở vị trí này cũng rất đặc biệt chúng béo trắng nhưng không hề gây ngấy khi ăn Gân thì gòn chứ không cứng như nhiều người nghĩ Đây là những điểm giúp gầu bò Mỹ St Helens nhận được sự ưu ái của thực khách Gầu bò Mỹ St Helens là một thực phẩm cao cấp được nhập khẩu trực tiếp từ Mỹ Chúng được đông lạnh với công nghệ hiện đại giúp kéo dài thời gian sử dụng mà vẫn giữ được hương vị vô thơm ngon vốn có rất tiện lợi cho mọi gia đình nhà hàng khách sạn để làm mới những món ăn thường ngày hoặc đãi tiệc của gia đình Việt THÔNG TIN SẢN PHẨM GẦU BÒ MỸ ST HELENS Quy cách đóng gói Thái lát mỏng 1 2mm khay 500gr Bảo quản 18 độ hoặc trong ngăn đá tủ lạnh HSD 2 năm kể từ ngày sản xuất Nên dùng trong vòng 5 ngày sau khi mở hộp Chế biến món lẩu nướng xào phở bò gaubomy gaubo bomy gau Sthelens thitgaubomy bomynuong Beefhouse gaubomy500gr gaubongon monngontubo gaubobeefhouse gaubomysthelens ngon gaubotuoingon
https://vinmart.co/dau-hu-pho-mai-eb-cheese-tofu-nhap-khau-malaysia-l1855539095.html,Đậu Hủ Phô Mai EB Cheese Tofu nhập khẩu Malaysia,STK_Vinhdu,83000,Còn hàng,Không có,Giới thiệu Đậu Hủ Phô Mai EB Cheese Tofu nhập khẩu Malaysia MÔ TẢ SẢN PHẨM ĐẬU HỦ PHO MAI CHEESE TOFU Nhập khẩu Malaysia sản xuất bởi EB Frozen Food Sdn Bhd danh tiếng toàn Châu Á Hạn sử dụng 2 năm In trên bao bì Bảo quản ngăn đá tủ lạnh Khối lượng đóng gói 500g gói Thành Phần Surimi 50 muối đường tinh bột sắn bột lòng trắng trứng đạm đậu nành dầu thực vật phô mai Sản phầm được sử dụng chiên giòn xào hấp bỏ vào lẩu và nấu món Tokbokki Hàn Quốc Đặc biệt là ăn với Mì gói là không chê đâu được Lưu ý sản phẩm chỉ ship nhanh khu vực Tp Hồ Chí Minh Cám ơn quý khách hàng đã tin dùng và ủng hộ sản phẩm của shop mình dauhuphomai dauhueb dauhuphomai cheesetofu eb ebcheesetofu
https://vinmart.co/bap-hoa-trau-60s-giao-sieu-toc-t110974014.html,BẮP HOA TRÂU 60S Giao siêu tốc ,QUÂN ANH FOOD,160000,Đang cập nhật,Không có,Giới thiệu BẮP HOA TRÂU 60S Giao siêu tốc Thịt bắp hoa có mã số 60s được nhập khẩu chính ngạch từ Ấn Độ Đây là loại thịt có nhiều đường vân hoa xen kẽ trong miếng thịt nhìn trong đẹp mắt Không những vậy mà các đường vân hoa này ăn còn rất ngon mùi vị sần sần kết hợp với thịt mềm tạo nên mùi vị đặc trưng chỉ có trong thịt bắp hoa 60s mới có được Thịt bắp hoa 60s nằm ở phía bên trong của phần bắp chân chiếm tỉ lệ rất ít trong mỗi con trâu và mang lại giá trị dinh dưỡng rất cao nên thịt ở phần này có giá cao nhất trong các loại bắp Thành phần 100 thịt trâu Ấn nhập khẩu Phân loại khối 1kg bào mỏng khay 500gr Bảo quản ở nhiệt độ 18 độ C
https://vinmart.co/bap-bo-uc-jmf-1kg-t102159198.html,Bắp Bò Úc JMF 1kg,JENNIE FOOD,260000,Đang cập nhật,Không có,Giới thiệu Bắp Bò Úc JMF 1kg Với sản phẩm tươi sống trọng lượng thực tế có thể chênh lệch khoảng 10 Đặc điểm của bắp bò Úc Trong thịt bắp bò úc cung cấp axit amin vitamin B6 vitamin B12 bổ sung năng lượng cho hệ thần kinh hệ cơ và tăng sức dẻo dai của cơ thể Bên cạnh đó hàm lượng sắt kẽm và protein trong thịt bò Úc nhiều gấp đôi so với cá và thịt gia cầm Ăn thịt bắp bò úc không chỉ làm giảm nguy cơ mắc bệnh thiếu máu mà còn giúp tăng cường hệ miễn dịch phòng ngừa bệnh tật Vị trí của bắp bò Úc Là thịt được lấy ra từ cơ đùi của con bò Đặc điểm của phần cơ bắp này là vận động liên tục nên thịt rất chắc và nhiều gân thời gian chế biến thường lâu hơn các phần thịt bò Úc khác Khi ăn thịt bắp bò Úc sẽ cảm nhận được vị ngọt tự nhiên và hương thơm đặc trưng cảm giác sần sật giòn giòn dai dai rất hợp khẩu vị của cánh mày râu Chế biến món gì từ bắp bò Úc Bắp bò Úc thường được dùng để chế biến các món ăn như lẩu bò phở bò bò kho bò hầm bò sốt vang bò luộc bò xào bò nướng bò hấp bò ngâm dấm bắp bò muốất ngon miệng 
https://vinmart.co/suon-be-heo-my-thom-ngon-chat-luong-500g-shopeefarm-s7895113303.html,Sườn Bẹ Heo Mỹ Thơm Ngon Chất lượng 500G Shopeefarm,ShopeeFarm (TP. Hồ Chí Minh),102700,Còn hàng,TP. Hồ Chí Minh,Giới thiệu Sườn Bẹ Heo Mỹ Thơm Ngon Chất lượng 500G Shopeefarm Trọng lượng 500g Trọng lượng thực tế có thể chênh lệch khoảng 10 HSD Bảo quản đông lạnh sử dụng trong 7 ngày khi chuyển qua nhiệt độ 0 4 độ trong tủ mát Sườn heo hay còn gọi là Sườn Lợn chắc chắn là thứ nguyên liệu mà bất cứ người đầu bếp nào từ chuyên nghiệp cho tới những bà nội trợ gia đình đều sử dụng thường xuyên trong những bữa ăn Sự kết hợp hoàn hảo giữa thịt và độ ngọt của tủy xương giúp sườn heo giữ vững trong danh sách là một trong những loại thịt heo được yêu thích nhất Sườn heo của SHOPEEFARM có gì đặc biệt Sườn heo được nhập khẩu trực tiếp qua đường bay về Việt Nam An toàn cho sức khỏe Sườn heo đáp ứng tiêu chuẩnquốc tế đáp ứng chất lượng và quy định về kiểm dịch khi nhập khẩu về Việt Nam Sườn heo được bảo quản đúng tiêu chuẩn tại kho của SHOPEEFARM giữ được hương vị tươi ngon khi giao tới tận tay khách hàng Cách bảo quản Bọc kín trong hộp hoặc túi nilon bảo quản trong ngăn đá Cam kết của NGON VIETNAM đối với khách hàng Sản phẩm có xuất xứ rõ ràng Quá trình chăn nuôi không sử dụng hóa chất có hại cho sức khỏe Quy trình sơ chế và đóng gói đảm bảo vệ sinh an toàn thực phẩm Cam kết hoàn trả nếu phát hiện sản phẩm thiếu hỏng Với tâm huyết mang đến sản phẩm chất lượng hơn mỗi ngày chúng mình luôn sẵn sàng lắng nghe phản hồi của các bạn qua Hotline 098 432 5105 Fanpage NGON VIETNAM Mua hàng tại Shopee NGON VIETNAM Kí tên Đội ngũ NGON VIETNAM shopeefarm ngonvietnam ngonhcm suonheo suonbeheo donglanh ngonbore
https://vinmart.co/dui-toi-ga-my-1kg-t92097635.html,Đùi tỏi gà Mỹ 1kg,Shop Quoc Thinh Foods,45000,Đang cập nhật,Không có,Giới thiệu Đùi tỏi gà Mỹ 1kg Với sản phẩm tươi sống trọng lượng thực tế có thể chênh lệch khoảng 10 Công ty TNHH Thực Phẩm Quốc Thịnh chuyên nhập khẩu các loại thịt đông lạnh và thịt tươi như cá bò heo gà cừu trâu và hải sản từ khắp các nước trên Thế Giới như Mỹ Canada Brazil Tây Ban Nha BaLan Pháp Nga úng tôi phân phối trên toàn quốc Shop cam kết 100 sản phẩm được nhập khẩu chính ngạch đầy đủ các chứng từ nhập khẩu giấy phép nhập khẩu giấy chứng nhận ATVSTP Shop có cắt thái theo yêu cầu của quý khách vui lòng nhắn tin cho shop để được hỗ trợ nhé Nếu bạn là người của tỉnh khác có nhu cầu mua khối lượng lớn hoặc cần biết nhiều thông tin hơn liên hệ 091 876 9998 Fanpage Quoc Thinh Foods Cửa hàng 148 150 Song Hành KĐT Lakeview City Phường An Phú Quận 2 TP HCM thitheo thitbo thitbouc thitbomy đùigà canhga thitheo baroi bachi cotlet monngon bep nauan thitbosach quocthinh quocthinhfoods food thitnhapkhau thitbonhapkhau thitheonhapkhau
https://vinmart.co/suon-cuu-uc-500g-t98089118.html,Sườn Cừu Úc 500g,Shop Quoc Thinh Foods,225000,Đang cập nhật,Không có,Giới thiệu Sườn Cừu Úc 500g Với sản phẩm tươi sống trọng lượng thực tế có thể chênh lệch khoảng 10 Công ty TNHH Thực Phẩm Quốc Thịnh chuyên nhập khẩu các loại thịt đông lạnh và thịt tươi như cá bò heo gà cừu trâu và hải sản từ khắp các nước trên Thế Giới như Mỹ Canada Brazil Tây Ban Nha BaLan Pháp Nga úng tôi phân phối trên toàn quốc Shop cam kết 100 sản phẩm được nhập khẩu chính ngạch đầy đủ các chứng từ nhập khẩu giấy phép nhập khẩu giấy chứng nhận ATVSTP Shop có cắt thái theo yêu cầu của quý khách vui lòng nhắn tin cho shop để được hỗ trợ nhé Nếu bạn là người của tỉnh khác có nhu cầu mua khối lượng lớn hoặc cần biết nhiều thông tin hơn liên hệ 091 876 9998 Fanpage Quoc Thinh Foods Cửa hàng 148 150 Song Hành KĐT Lakeview City Phường An Phú Quận 2 TP HCM thitheo thitbo thitbouc thitbomy đùigà canhga thitheo baroi bachi cotlet monngon bep nauan thitbosach quocthinh quocthinhfoods food thitnhapkhau thitbonhapkhau thitheonhapkhau
https://vinmart.co/bap-bo-uc-t85036954.html,Bắp Bò Úc,Thế Giới Bò Sạch Hotfood,230000,Đang cập nhật,Không có,Giới thiệu Bắp Bò Úc Trong thịt bắp bò úc cung cấp axit amin vitamin B6 vitamin B12 bổ sung năng lượng cho hệ thần kinh hệ cơ và tăng sức dẻo dai của cơ thể Bên cạnh đó hàm lượng sắt kẽm và protein trong thịt bò Úc nhiều gấp đôi so với cá và thịt gia cầm Ăn thịt bắp bò úc không chỉ làm giảm nguy cơ mắc bệnh thiếu máu mà còn giúp tăng cường hệ miễn dịch phòng ngừa bệnh tật Vị trí của bắp bò Úc Là thịt được lấy ra từ cơ đùi của con bò Đặc điểm của phần cơ bắp này là vận động liên tục nên thịt rất chắc và nhiều gân thời gian chế biến thường lâu hơn các phần thịt bò Úc khác Khi ăn thịt bắp bò Úc sẽ cảm nhận được vị ngọt tự nhiên và hương thơm đặc trưng cảm giác sần sật giòn giòn dai dai rất hợp khẩu vị của cánh mày râu 
https://vinmart.co/canh-giua-ga-500gr-khay-t105359492.html,Cánh giữa gà 500gr khay,Nam Khải Phú,59000,Đang cập nhật,Không có,Giới thiệu Cánh giữa gà 500gr khay Với sản phẩm tươi sống trọng lượng thực tế có thể chênh lệch khoảng 10 Thịt gà giàu năng lượng ít chất béo mang đến rất nhiều lợi ích sức khỏe Đây là loại thịt giàu năng lượng ít chất béo mang đến rất nhiều lợi ích sức khỏe thần kỳ được các chuyên gia dinh dưỡng khuyên sử dụng hằng ngày 1 Hàm lượng protein cao 2 Chống trầm cảm 3 Ngừa loãng xương 4 Tốt cho sức khỏe tim mạch 5 Giàu phốt pho 6 Cải thiện hệ miễn dịch tăng cường trao đổi chất 7 Tăng cường trao đổi chất QUY CÁCH ĐÓNG GÓI Đóng theo vỉ THÀNH PHẦN 100 thịt gà nhập khẩu HƯỚNG DẪN CHẾ BIẾN Rã đông và chế biến trước khi sử dụng 
https://vinmart.co/de-suon-trau-an-do-buffalo-rib-finger-500g-t102848317.html,Dẻ sườn trâu Ấn Độ Buffalo Rib finger 500g,Taiducfood,90000,Đang cập nhật,Không có,Giới thiệu Dẻ sườn trâu Ấn Độ Buffalo Rib finger 500g Với sản phẩm tươi sống trọng lượng thực tế có thể chênh lệch khoảng 10 
https://vinmart.co/bap-bo-uc-cat-khuc-beef-shin-shank-aus-t95973260.html,Bắp bò Úc cắt khúc beef shin shank Aus,Taiducfood,134500,Đang cập nhật,Không có,Giới thiệu Bắp bò Úc cắt khúc beef shin shank Aus Bắp bò Úc cắt khúc 400 500g beef shin shank Aus
https://vinmart.co/canh-ga-giua-1kg-t102895899.html,Cánh Gà Giữa 1KG,THỰC PHẨM TUẤN VINA,120000,Đang cập nhật,Không có,Giới thiệu Cánh Gà Giữa 1KG Với sản phẩm tươi sống trọng lượng thực tế có thể chênh lệch khoảng 10 Tươi ngon
https://vinmart.co/nam-trau-an-do-dg-t97647123.html,Nạm Trâu Ấn Độ ĐG,Taiducfood,126000,Đang cập nhật,Không có,Giới thiệu Nạm Trâu Ấn Độ ĐG Nạm Trâu Ấn Độ ĐG 900g Halal buffalo FQ Slice
https://vinmart.co/bap-bo-uc-dtp-1kg-t107155688.html,Bắp Bò Úc DTP 1KG,THỰC PHẨM TUẤN VINA,219000,Đang cập nhật,Không có,Giới thiệu Bắp Bò Úc DTP 1KG Với sản phẩm tươi sống trọng lượng thực tế có thể chênh lệch khoảng 10 là phần thịt được pha lọc từ thịt bắp con bò có những đường gân nhỏ trong thớ thịt Thịt bắp ăn có vị thơm giòn và thích hợp với các món lẩu Top of Form
https://vinmart.co/dui-toi-ga-dong-lanh-500gr-t91466394.html,Đùi tỏi gà đông lạnh 500gr,E Mall,49000,Đang cập nhật,Không có,Giới thiệu Đùi tỏi gà đông lạnh 500gr Với sản phẩm tươi sống trọng lượng thực tế có thể chênh lệch khoảng 10 Đùi tỏi gà là phần thịt đùi trên đầu gối và dưới mông gà Có thể nói đây là bộ phận ngon nhất của con gà vì được hoạt động nhiều nên thịt chắc và ngon Đùi tỏi gà chứa nhiều chất dinh dưỡng có lợi cho sức khỏe Đây là loại thực phẩm chứa nhiều vitamin như vitamin A B1 B2 C E axit canxi photpho sắ Cơ thể con người dễ hấp thu và tiêu hóa Hàm lượng dinh dưỡng có trong Đùi tỏi Gà Trong một con gà mỗi bộ phận sẽ có giá trị dinh dưỡng khác nhau Riêng đối với đùi tỏi gà thì hàm lượng đạm chất béo các vitamin như A B C E là rất cao Cụ thể trong 100g tỏi gà có da thì hàm lượng dinh dưỡng như sau Năng lượng 187 calo Trọng đó năng lượng từ chất béo chiếm 109 calo Hàm hương chất béo 12 1g Hàm lượng bột đường 0g Hàm lượng protein 18 2g Hàm lượng Vitamin A chiếm 2 C chiếm 4 sắt chiếm 6 và canxi chiếm 1 Thịt gà cấp đông sẽ được giữ nguyên hàm lượng chất béo protein và một số chất dinh dưỡng khác Tuy nhiên lượng vitamin có thể bị mất đi một phần nhưng không quá cao dưới 50 Các món ngon được chế biến từ đùi tỏi gà Đùi gà sốt cà chua và ớt chuông Đùi gà sốt me chua ngọt Đùi gà rô ti Đùi gà rim mật mía Đùi gà chiên Đùi gà kho Đùi gà nướng Đùi gà chiên giòn Đùi gà bó xôi
https://vinmart.co/suon-cuu-uc-cat-nuong-lamb-rack-aus-t96515825.html,Sườn cừu Úc cắt nướng Lamb rack Aus,E Mall,242500,Đang cập nhật,Không có,Giới thiệu Sườn cừu Úc cắt nướng Lamb rack Aus Sườn cừu Úc cắt nướng Lamb rack Aus
https://vinmart.co/gu-bo-uc-t90590810.html,Gù Bò Úc,Shop Quoc Thinh Foods,160000,Đang cập nhật,Không có,Giới thiệu Gù Bò Úc Trọng lượng 500g Gù bò Úc được coi là một trong những phần ngon nhất của con bò Úc thịt gù bò Úc có thịt và mỡ đan xen nhìn rất hấp dẫn và ăn rất ngon
https://vinmart.co/dui-toi-ga-nhap-khau-giao-sieu-toc-tui-1kg-t110972356.html,ĐÙI TỎI GÀ NHẬP KHẨU Giao siêu tốc Túi 1kg,QUÂN ANH FOOD,70000,Đang cập nhật,Không có,Giới thiệu ĐÙI TỎI GÀ NHẬP KHẨU Giao siêu tốc Túi 1kg Với sản phẩm tươi sống trọng lượng thực tế có thể chênh lệch khoảng 10 Đùi gà tỏi là phần thịt đùi trên đầu gối và dưới mông gà Có thể nói đây là bộ phận ngon nhất của con gà vì được hoạt động nhiều nên thịt chắc và ngon Đùi gà tỏi chế biến được rất nhiều món ngon đặc biệt được các quán cơm gà xối mỡ sử dụng rất nhiều Thành phần 100 thịt gà Mỹ nhập khẩu Phân loại túi 1kg gồm 7 8 cái đùi gà Bảo quản ở nhiệt độ 18 độ C HDSD rã đông và làm chín trước khi ăn
https://vinmart.co/phile-than-noi-trau-an-do-buffalo-tenderloin-t97647118.html,Philê Thăn nội trâu Ấn Độ Buffalo tenderloin,E Mall,114000,Đang cập nhật,Không có,Giới thiệu Philê Thăn nội trâu Ấn Độ Buffalo tenderloin Philê Thăn nội trâu Ấn Độ Buffalo tenderloin
https://vinmart.co/bap-bo-my-hotpot-500gr-t59208061.html,Bắp bò Mỹ Hotpot 500gr,ORGANIC SEN HỒNG,139000,Đang cập nhật,Không có,Giới thiệu Bắp bò Mỹ Hotpot 500gr Với sản phẩm tươi sống trọng lượng thực tế có thể chênh lệch khoảng 10 Đặc điểm của bắp bò Mỹ Trong thịt bắp bò cung cấp axit amin vitamin B6 vitamin B12 bổ sung năng lượng cho hệ thần kinh hệ cơ và tăng sức dẻo dai của cơ thể Bên cạnh đó hàm lượng sắt kẽm và protein trong thịt bò nhiều gấp đôi so với cá và thịt gia cầm Ăn thịt bắp bò không chỉ làm giảm nguy cơ mắc bệnh thiếu máu mà còn giúp tăng cường hệ miễn dịch phòng ngừa bệnh tật Khi ăn thịt bắp bò sẽ cảm nhận được vị ngọt tự nhiên và hương thơm đặc trưng cảm giác sần sật giòn giòn dai dai rất hợp khẩu vị của cánh mày râu Món ăn gợi ý Bắp bò thường được dùng để chế biến các món ăn như lẩu bò phở bò bò kho bò hầm bò sốt vang bò luộc bò xào bò nướng bò hấp bò ngâm dấm bắp bò muối rất ngon miệng 
https://vinmart.co/dui-ga-goc-tu-my-1kg-t92097640.html,Đùi gà góc tư Mỹ 1kg,Shop Quoc Thinh Foods,35000,Đang cập nhật,Không có,Giới thiệu Đùi gà góc tư Mỹ 1kg Với sản phẩm tươi sống trọng lượng thực tế có thể chênh lệch khoảng 10 Công ty TNHH Thực Phẩm Quốc Thịnh chuyên nhập khẩu các loại thịt đông lạnh và thịt tươi như cá bò heo gà cừu trâu và hải sản từ khắp các nước trên Thế Giới như Mỹ Canada Brazil Tây Ban Nha BaLan Pháp Nga úng tôi phân phối trên toàn quốc Shop cam kết 100 sản phẩm được nhập khẩu chính ngạch đầy đủ các chứng từ nhập khẩu giấy phép nhập khẩu giấy chứng nhận ATVSTP Shop có cắt thái theo yêu cầu của quý khách vui lòng nhắn tin cho shop để được hỗ trợ nhé Nếu bạn là người của tỉnh khác có nhu cầu mua khối lượng lớn hoặc cần biết nhiều thông tin hơn liên hệ 091 876 9998 Fanpage Quoc Thinh Foods Cửa hàng 148 150 Song Hành KĐT Lakeview City Phường An Phú Quận 2 TP HCM thitheo thitbo thitbouc thitbomy đùigà canhga thitheo baroi bachi cotlet monngon bep nauan thitbosach quocthinh quocthinhfoods food thitnhapkhau thitbonhapkhau thitheonhapkhau
https://vinmart.co/trau-gac-bep-tay-bac-t102895913.html,Trâu gác bếp Tây Bắc,Thực phẩm cao cấp H And H,450000,Đang cập nhật,Không có,Giới thiệu Trâu gác bếp Tây Bắc Với sản phẩm tươi sống trọng lượng thực tế có thể chênh lệch khoảng 10 Trâu gác bếp Tây Bắc Đóng gói 500g
https://vinmart.co/loi-vai-bo-my-1kg-t97553249.html,Lõi vai bò Mỹ 1kg,JENNIE FOOD,400000,Đang cập nhật,Không có,Giới thiệu Lõi vai bò Mỹ 1kg Với sản phẩm tươi sống trọng lượng thực tế có thể chênh lệch khoảng 10 Lõi nạc vai bò Mỹ hay còn gọi là lõi vai thịt thăn vai theo kiểu Mỹ gọi là Top Blade hay top Muscle Blade là phần thịt bò sát cạnh và được cắt ra từ vòng cổ của bò Mỹ đặc trưng ở loại thịt này là độ giòn rụm ngọt thơm vì có những sợi gân mỏng xen giữa cây thăn bò Mỹ Lõi nạc vai có mỡ xen kỹ nạc rất đều và mịn tạo ra hương vị thơm ngậy mùi bơ 
https://vinmart.co/canh-ga-khuc-giua-500g-t92097637.html,Cánh gà khúc giữa 500g,Shop Quoc Thinh Foods,60000,Đang cập nhật,Không có,Giới thiệu Cánh gà khúc giữa 500g Với sản phẩm tươi sống trọng lượng thực tế có thể chênh lệch khoảng 10 Công ty TNHH Thực Phẩm Quốc Thịnh chuyên nhập khẩu các loại thịt đông lạnh và thịt tươi như cá bò heo gà cừu trâu và hải sản từ khắp các nước trên Thế Giới như Mỹ Canada Brazil Tây Ban Nha BaLan Pháp Nga úng tôi phân phối trên toàn quốc Shop cam kết 100 sản phẩm được nhập khẩu chính ngạch đầy đủ các chứng từ nhập khẩu giấy phép nhập khẩu giấy chứng nhận ATVSTP Shop có cắt thái theo yêu cầu của quý khách vui lòng nhắn tin cho shop để được hỗ trợ nhé Nếu bạn là người của tỉnh khác có nhu cầu mua khối lượng lớn hoặc cần biết nhiều thông tin hơn liên hệ 091 876 9998 Fanpage Quoc Thinh Foods Cửa hàng 148 150 Song Hành KĐT Lakeview City Phường An Phú Quận 2 TP HCM thitheo thitbo thitbouc thitbomy đùigà canhga thitheo baroi bachi cotlet monngon bep nauan thitbosach quocthinh quocthinhfoods food thitnhapkhau thitbonhapkhau thitheonhapkhau
https://vinmart.co/thit-vien-dinh-duong-nam-g-kitchen-300gr-t58472151.html,Thịt viên dinh dưỡng nấm G Kitchen 300gr,E Mall,77000,Đang cập nhật,Không có,Giới thiệu Thịt viên dinh dưỡng nấm G Kitchen 300gr Với sản phẩm tươi sống trọng lượng thực tế có thể chênh lệch khoảng 10 Thịt viên dinh dưỡng nấm 300gr có nguyên liệu từ nguồn thịt sạch 3F Plus với kỹ thuật cấp đông nhanh giúp giữ trọn vị ngọt tự nhiên của thịt cấu trúc thịt nhiều thớ nguyên được nêm nếm vừa vị kết hợp với nấm đông cô tạo nên viên thịt dai thơm đặc trưng dễ dàng kết hợp với nước súp mì bún chế biến thành các món ăn hấp dẫn cho cả gia đình 
https://vinmart.co/bap-bo-uc-bao-beef-shin-shank-aus-t95973230.html,Bắp bò Úc bào beef shin shank Aus,Taiducfood,134500,Đang cập nhật,Không có,Giới thiệu Bắp bò Úc bào beef shin shank Aus Bắp bò Úc bào beef shin shank Aus
https://vinmart.co/canh-ga-dong-lanh-500gr-t91469146.html,Cánh gà đông lạnh 500gr,ORGANIC SEN HỒNG,59000,Đang cập nhật,Không có,Giới thiệu Cánh gà đông lạnh 500gr Với sản phẩm tươi sống trọng lượng thực tế có thể chênh lệch khoảng 10 Cánh gà là một bộ phận của con gà là nguyên liệu khá quen thuộc để chế biến rất nhiều món ngon Thịt cánh gà tập trung chủ yếu là da và phần mỡ dư thừa tích tụ ở đây là khá lớn Khi chiên hoặc nướng mỡ gà chảy ra kèm với gia vị được ướp sẵn trước sẽ đem đến một hương thơm và vị ngon khó cưỡng Quy cách đóng gói 4 5 cái 500gr Bảo quản nhiệt độ dưới 18 độ C Cách sử dụng cánh gà đông lạnh rã đông ở nhiệt độ thường khoảng 30 phút sau đó đem rửa lại với nước sạch rồi chế biến tùy theo sở thích của bạn Cánh gà thường được sử dụng làm Cánh gà chiên nước mắm cánh gà rim cánh gà luộc chấm muối tiêu chanh 
https://vinmart.co/suon-cuu-uc-giao-sieu-toc-t110978805.html,SƯỜN CỪU ÚC Giao siêu tốc ,E Mall,400000,Đang cập nhật,Không có,Giới thiệu SƯỜN CỪU ÚC Giao siêu tốc Sườn cừu Lamb rack là phần thịt được pha lọc từ sườn của con cừu non được nuôi dưới 12 tháng mỗi bẹ sườn có từ 5 8 thanh sườn được pha cắt theo tiêu chuẩn Đây là phần thịt được yêu thích với vị ngọt và hương thơm đặc trưng của thịt cừu đồng thời do cấu trúc gồm một lớp mỡ mỏng rồi đến lớp thịt cuối cùng đến cây sườn nên thịt sườn cừu có độ mềm béo đầy hấp dẫn Phù hợp cho các món steak cừu sườn cừu nướng nguyên bẹ Bảo quản ở nhiệt độ 18 độ C HDSD rã đông và làm chín trước khi ăn 
