https://vinmart.co/dui-ga-uop-nuong-3-cai-t115968948.html,Đùi gà ướp nướng 3 cái,Thực phẩm ướp sẵn Cơm Sài Gòn,63000,Đang cập nhật,Không có,Giới thiệu Đùi gà ướp nướng 3 cái Với sản phẩm tươi sống trọng lượng thực tế có thể chênh lệch khoảng 10 Đùi gà ướp nướng 3 cái Hàng luôn mới làm trong ngày 
https://vinmart.co/hcm-gan-trau-1-kg-giao-nhanh-tphcm-t152020442.html,HCM Gân trâu 1 kg Giao nhanh TPHCM ,TOPMEAL,318000,Đang cập nhật,Không có,Giới thiệu HCM Gân trâu 1 kg Giao nhanh TPHCM Với sản phẩm tươi sống trọng lượng thực tế có thể chênh lệch khoảng 10 update
https://vinmart.co/than-ngoai-uc-t90590835.html,Thăn Ngoại Úc,Shop Quoc Thinh Foods,175000,Đang cập nhật,Không có,Giới thiệu Thăn Ngoại Úc Công ty TNHH Thực Phẩm Quốc Thịnh chuyên nhập khẩu các loại thịt đông lạnh và thịt tươi như cá bò heo gà cừu trâu và hải sản từ khắp các nước trên Thế Giới như Mỹ Canada Brazil Tây Ban Nha BaLan Pháp Nga chúng tôi có lẻ trên toàn quốc Shop cam kết 100 sản phẩm được nhập khẩu chính ngạch đầy đủ các chứng từ nhập khẩu giấy phép nhập khẩu giấy chứng nhận ATVSTP Shop có cắt thái theo yêu cầu của quý khách vui lòng nhắn tin cho shop để được hỗ trợ nhé Nếu bạn là người của tỉnh khác có nhu cầu mua khối lượng lớn hoặc cần biết nhiều thông tin hơn liên hệ HOTLINE 24 7 Mua lẻ 091 876 9998 zalo sms website www quocthinhfoods com Fanpage Quoc Thinh Foods Cửa hàng 148 150 Song Hành KĐT Lakeview City Phường An Phú Quận 2 TP HCM thitheo thitbo thitbouc thitbomy đùigà canhga thitheo baroi bachi cotlet monngon bep nauan thitbosach quocthinh quocthinhfoods food thitnhapkhau thitbonhapkhau thitheonhapkhau
https://vinmart.co/chan-ga-co-xuong-1kg-t116248335.html,Chân gà có xương 1KG,QUÂN ANH FOOD,85000,Đang cập nhật,Không có,Giới thiệu Chân gà có xương 1KG Với sản phẩm tươi sống trọng lượng thực tế có thể chênh lệch khoảng 10 Chân gà nhập khẩu Brasil Đóng gói túi 1kg hút chân không Bảo quản 18 độ C HDSD rã đông và làm chín trước khi dùng Dùng để nướng ngâm sả tắc sốt thái hấp tiêu 
https://vinmart.co/hcm-de-suon-trau-1-kg-giao-nhanh-tphcm-t152020444.html,HCM Dẻ sườn trâu 1 kg Giao nhanh TPHCM ,TOPMEAL,112000,Đang cập nhật,Không có,Giới thiệu HCM Dẻ sườn trâu 1 kg Giao nhanh TPHCM Với sản phẩm tươi sống trọng lượng thực tế có thể chênh lệch khoảng 10 update
https://vinmart.co/bap-bo-uc-va-ba-roi-bo-my-mvp-khay-500g-t55675643.html,Bắp bò Úc và Ba rọi bò Mỹ MVP khay 500g,CỬA HÀNG THỰC PHẨM MEGADELI,239000,Đang cập nhật,Không có,Giới thiệu Bắp bò Úc và Ba rọi bò Mỹ MVP khay 500g Với sản phẩm tươi sống trọng lượng thực tế có thể chênh lệch khoảng 10 Bắp bò Úc và ba rọi bò Mỹ MVP khay 500g nhập khẩu trực tiếp từ Úc và Mỹ 100 cắt và đóng gọi tại Nhà Máy MEGADELI KCN Long Hậu Gói thịt có thể dễ dàng dữ trữ Khi sử dụng bạn chỉ cần rã đông là có thể dùng ngay Giá trị dinh dưỡng Duy trì cơ bắp Nâng cao hiệu suất tập thể dục Phòng chống thiếu máu Tiêu chuẩn và chứng nhận chất lượng Đạt chứng nhận chất lượng VSATTP và HACCP Thành phần 100 bò Úc và Mỹ Món ngon đề xuất Nướng BBQ Lẩu
https://vinmart.co/uc-ga-phile-cp-500gr-t116102433.html,Ức gà philê CP 500gr,E Mall,90000,Đang cập nhật,Không có,Giới thiệu Ức gà philê CP 500gr Với sản phẩm tươi sống trọng lượng thực tế có thể chênh lệch khoảng 10 Thịt gà chứa nhiều chất dưỡng chất có lợi cho sức khoẻ Đồng thời loại thịt này còn có thể chế biến thành rất nhiều món ăn ngon như hấp la gu rô ti cà riTheo các nhà dinh dưỡng học ngoài những chất albumin chất béo thịt gà còn có các vitamin A B1 B2 C E axit canxi photpho sắt Đóng gói 500gr
https://vinmart.co/hcm-duoi-trau-500g-giao-nhanh-tphcm-t152020445.html,HCM Đuôi trâu 500g Giao nhanh TPHCM ,TOPMEAL,183000,Đang cập nhật,Không có,Giới thiệu HCM Đuôi trâu 500g Giao nhanh TPHCM Với sản phẩm tươi sống trọng lượng thực tế có thể chênh lệch khoảng 10 update
https://vinmart.co/bap-hoa-bo-my-cat-mong-heel-muscle-500gr-t85890659.html,Bắp Hoa Bò Mỹ cắt mỏng Heel Muscle 500gr,Bà Bông Market,200000,Đang cập nhật,Không có,Giới thiệu Bắp Hoa Bò Mỹ cắt mỏng Heel Muscle 500gr Với sản phẩm tươi sống trọng lượng thực tế có thể chênh lệch khoảng 10 Bắp hoa bò mỹ nhập khẩu bảo đảm tươi sống và sạch 
https://vinmart.co/dui-toi-ga-cp-500gr-t116102435.html,Đùi tỏi gà CP 500gr,E Mall,90000,Đang cập nhật,Không có,Giới thiệu Đùi tỏi gà CP 500gr Với sản phẩm tươi sống trọng lượng thực tế có thể chênh lệch khoảng 10 Đùi tỏi gà tươi ngon truy xuất nguồn gốc rõ ràng an toàn chất lượng Sản phẩm đóng bao hoặc khay 500gr 
https://vinmart.co/thit-phi-le-ca-sau-tui-kg-t152377318.html,Thịt Phi Lê Cá Sấu túi kg,Hải Sản Đại Dương Xanh,120000,Đang cập nhật,Không có,Giới thiệu Thịt Phi Lê Cá Sấu túi kg Với sản phẩm tươi sống trọng lượng thực tế có thể chênh lệch khoảng 10 Thịt phi lê cá sấu có màu trắng hồng Thớ thịt gần giống như thịt bê nhưng mềm ngọt và dẻo hơn Thịt cá sấu chiên giòn hấp ướp me rang muối nướng hoặc chỉ cần cho thịt cá sấu vào nấu cháo cũng rất hấp dẫn Thịt cá sấu có ít năng lượng và mỡ hơn với các loại thịt truyền thống như heo bò cừu Thịt cá sấu có màu trắng hồng thớ thịt gần giống thịt bê nhưng ngọt mềm và dẻo hơn Các loại thịt cá sấu ở những bộ phận khác nhau như đùi phi lê cổ đuôi sườn đều có độ dai mềm và mùi vị rất khác nhau có thể chế biến ra nhiều món ăn hấp dẫn Theo tạp chí y học QJM ĐH Oxford Anh thịt cá sấu trị được bệnh hen suyễn Ở Trung Quốc đất nước tiêu thụ thịt cá sấu nhiều nhất người dân tin rằng ăn thịt sấu sẽ lọc máu độc bồi bổ sức khoẻ tăng sinh lực Nhiều cuộc khảo sát về dinh dưỡng cũng ghi nhận quá trình nấu nướng không ảnh hưởng đến tính dinh dưỡng thành phần axit amin và chất khoáng của thịt cá sấu Thịt cá sấu có vị lạ dai nhưng lại mềm mại của miếng thịt cá nhưng lại không phải là cá mà mềm mại với sớ thịt gần giống thịt bê Có thể chế biến thành nhiều món ăn mang hương vị đặc trưng khác với các loại thịt khác như gỏi xoài cá sấu cá sấu tiềm thuốc bắc cà ri cá sấu lúc lắc cá sấ Thịt cá sấu là thực phẩm quý đối với con người Thịt cá sấu là món ăn ngon bổ dưỡng Từ lâu đời người Trung Quốc và người Úc rất ưa chuộng các món ăn chế biến từ thịt cá sấu vì cho rằng nó có tác dụng lọc máu giải độc tăng cường sức khỏe Thịt cá sấu có giá trị dinh dưỡng cao chất protein trong thịt cá sấu thuộc loại đạm quý lượng đạm chiếm tới 21 22 So với thịt lợn gà bò thì ít chất béo hơn nhưng chất khoáng nhiều hơn hẳn Trong thịt cá sấu có 17 loại axit amin đặc biệt chứa 7 loại axit amin threonine methionine isoleucine leucine phenilalanine lysine HCL histidine mà cơ thể con người không tự tổng hợp được Vì vậy thịt cá sấu rất hữu ích nếu dùng để bồi dưỡng cho người bệnh phòng chống suy dinh dưỡng ở trẻ em Thịt cá sấu tăng cường hệ miễn dịch cho cơ thể Nhiều nghiên cứu khoa học cho thấy hệ miễn dịch của cá sấu rất mạnh giúp chúng tự chữa lành các vết thương nhanh chóng và ngăn chặn nguy cơ lây nhiễm các mầm bệnh Người ta dùng máu cá sấu để chế biến rượu huyết sấu loại rượu này cung cấp một lượng lớn oxy và chứa nhiều chất kháng sinh tự nhiên 
https://vinmart.co/ba-roi-bo-my-t90590758.html,Ba Rọi Bò Mỹ,Shop Quoc Thinh Foods,135000,Đang cập nhật,Không có,Giới thiệu Ba Rọi Bò Mỹ Công ty TNHH Thực Phẩm Quốc Thịnh chuyên nhập khẩu các loại thịt đông lạnh và thịt tươi như cá bò heo gà cừu trâu và hải sản từ khắp các nước trên Thế Giới như Mỹ Canada Brazil Tây Ban Nha BaLan Pháp Nga Shop cam kết 100 sản phẩm được nhập khẩu chính ngạch đầy đủ các chứng từ nhập khẩu giấy phép nhập khẩu giấy chứng nhận ATVSTP Shop có cắt thái theo yêu cầu của quý khách vui lòng nhắn tin cho shop để được hỗ trợ nhé Chế biến Nhúng lẫu cuốn bánh tráng nướng xào với các loại rau Nếu bạn là người của tỉnh khác có nhu cầu mua khối lượng lớn hoặc cần biết nhiều thông tin hơn liên hệ HOTLINE 24 7 Mua lẻ 091 876 9998 zalo sms website www quocthinhfoods com Fanpage Quoc Thinh Foods Cửa hàng 148 150 Song Hành KĐT Lakeview City Phường An Phú Quận 2 TP HCM thitheo thitbo thitbouc thitbomy đùigà canhga thitheo baroi bachi cotlet monngon bep nauan thitbosach quocthinh quocthinhfoods food thitnhapkhau thitbonhapkhau thitheonhapkhau
https://vinmart.co/canh-ga-khuc-giua-nhap-khau-osh-1kg-t116195964.html,Cánh gà khúc giữa nhập khẩu OSH 1kg,E Mall,129000,Đang cập nhật,Không có,Giới thiệu Cánh gà khúc giữa nhập khẩu OSH 1kg Với sản phẩm tươi sống trọng lượng thực tế có thể chênh lệch khoảng 10 Xuất xứ Mỹ Đóng gói khay 1 kg Bảo quản 18 độ C Hạn sử dụng 6 tháng kể từ ngày đóng gói ĐẶC ĐIỂM CỦA CÁCH KHÚC GIỮA GÀ Nếu như trong toàn bộ cánh gà phần đầu cánh quá nhiều xương phần cánh sát với thân gà quá nhiều thịt thì phần khúc giữa cánh gà chính là vị trí được ưa chuộng nhất Phần thịt này không quá xương không quá có nhiều thịt trắng gây khô ngán chính vì vậy sản phẩm này luôn hút khách Cánh giữa gà được phân tách riêng cực kỳ tiện dụng với những gia đình có trẻ con hoặc với những bạn mê mẩn món gà rán So với việc cá bạn mua cánh gà nguyên chiếc về và chỉ sử dụng phần cánh giữa thì sẽ thật lãng phí cũng như khó xử lý những phần còn lại của cánh gà Chính vì đặc điểm này mà cánh gà khúc giữa ra mắt và cực kỳ được ưa chuộng Hầu hết những nhà hàng quán ăn đặc biệt là những quán gà rán gà nướng đều ưa chuộng sử dụng phần cánh gà khúc giữa này 
https://vinmart.co/thit-than-ca-sau-tui-1kg-t152380236.html,Thịt Thăn Cá Sấu túi 1kg,E Mall,180000,Đang cập nhật,Không có,Giới thiệu Thịt Thăn Cá Sấu túi 1kg Với sản phẩm tươi sống trọng lượng thực tế có thể chênh lệch khoảng 10 Thịt thăn Cá Sấu nghe có vẻ lại với nhiều người nhưng nó là một trong những phần thịt ngon nhất của loài cá sấu này Miếng thịt thăn thuần nạc đặc rất mềm cắt thớ nhỏ và có độ kết dính cao đây là phần ngon nhất trong con cá sấu Thịt thăn cá sấu ăn có ngon không có tốt không Thịt cá sấu có vị lạ dai nhưng lại mềm mại giống với sớ thịt gần giống thịt bê và được nhiều người nhận xét là khá ngon Ngoài hương vị độc đáo ra đây có thể được coi là một siêu thực phẩm với một lượng lớn các chất dinh dưỡng thiết yếu có cơ thể Trong 120g loại thịt này chỉ chứa 4gr chất béo ít hơn cả thịt bò 14gr Trong 100g thịt thăn cá sấu chứa tới 46g protein Nó cũng là một nguồn cung cấp axit béo omega 3 và các khoáng chất như phốt pho kali vitamin B12 niacin và axit béo không bão hòa đơn Ngoài ra nó còn chứa rất ít cholesterol và chứa gần gấp đôi lượng chất dinh dưỡng cần xây dựng cơ bắp protein Theo Wikipedia Thịt cá sấu trị được bệnh suyễn hoặc sẽ lọc máu độc bồi bổ sức khỏe tăng cường sinh lực thích hợp dùng để bồi dưỡng người bệnh trẻ em suy dinh dưỡng Ngoài ra xương cá sấu phối hợp với một số loại dược thảo được dùng để nấu cao trị các chứng đau nhức khớp xương biếng ăn viêm xoang tăng cường sức đề kháng Thịt thăn cá sấu có thể chế biến nhiều món ăn ngon 
https://vinmart.co/nam-gau-bo-uc-cat-san-beef-brisket-500g-t103675765.html,Nạm gầu bò úc cắt sẵn beef brisket 500g,Taiducfood,132500,Đang cập nhật,Không có,Giới thiệu Nạm gầu bò úc cắt sẵn beef brisket 500g Với sản phẩm tươi sống trọng lượng thực tế có thể chênh lệch khoảng 10 Nạm gầu bò Úc cắt sẵn 500g Beef Brisket
https://vinmart.co/dui-ga-goc-tu-c-p-500gr-t116102457.html,Đùi gà góc tư C P 500gr,E Mall,90000,Đang cập nhật,Không có,Giới thiệu Đùi gà góc tư C P 500gr Với sản phẩm tươi sống trọng lượng thực tế có thể chênh lệch khoảng 10 Thịt gà chứa nhiều chất dưỡng chất có lợi cho sức khoẻ Đồng thời loại thịt này còn có thể chế biến thành rất nhiều món ăn ngon như hấp la gu rô ti cà riTheo các nhà dinh dưỡng học ngoài những chất albumin chất béo thịt gà còn có các vitamin A B1 B2 C E axit canxi photpho sắt Đóng gói 500gr
https://vinmart.co/me-ga-sach-tui-1kg-t152392055.html,Mề gà Sạch túi 1kg,Hải Sản Đại Dương Xanh,180000,Đang cập nhật,Không có,Giới thiệu Mề gà Sạch túi 1kg Với sản phẩm tươi sống trọng lượng thực tế có thể chênh lệch khoảng 10 Mề gà rất được dân nhậu yêu thích từ xưa đến giờ nó có thể làm được nhiều món ngon hấp dẫn lạ miệng mà còn có thê trị bệnh nữa Nơi cung cấp mề gà chất lượng Mề gà được khá nhiều người ưa thích vì độ giòn sần sật cực hấp dẫn cảu nó Nhưng lựa chọn nguồn thực phẩm sạch cũng là một vấn đề khá nan giải Mề gà hiện nay được bán ở các khu chợ thường không rõ nguồn gốc tuy tương đối rẻ nhưng lại chưa qua kiểm dịch cũng như qua các tiêu chuẩn vệ sinh thực phẩm khác có thể sản phẩm mắc một số bệnh dịch Nên mua mề gà ở đâu Để đảm bảo chất lượng của sản phẩm bạn nên mua ở những đại lý phân phối siêu thị uy tín Hải Sản Đại Dương Xanh là một đại lý phân phối lớn mề Đặc biệt Hải Sản Đại Dương Xanh có những chế độ ưu đãi dành cho người mua hàng với số lượng lớn và đảm bảo chất lượng sản phẩm luôn luôn đạt tiêu chuẩn Ngoài ra Hải Sản Đại Dương Xanh còn hỗ trợ cho quý khách dịch vụ giao hàng tận nơi cực kì tiện lợi Bạn cũng không phải sợ thiệt thòi vì nếu hàng có lỗi thì bạn cũng có thể đổi trả một cách dễ dàng CÁC CHẤT DINH DƯỠNG CÓ TRONG MỀ GÀ Hàm lượng calo theo nghiên cứu trong 100g mề gà chỉ chứa khoảng 94 calo Đây là hàm lượng calo cực nhỏ mà mỗi người cần phải nạp mỗi ngày Cholesterol trong 100g mề gà có chứa 240mg cholesterol Theo khuyến cáo thì hàm lượng cholestreol quá cao có thể làm ảnh hưởng đến lipid máu và tăng nguy cơ mắc bệnh tim mạch Hàm lượng này chỉ cần khoảng 200mg mỗi ngày Chất béo trong 100 gam mề gà có chứa khoảng 2 gam chất béo trong đó 1 gam là chất béo bão hòa và 1 gam chất béo không bão hòa đơn Vitamin và các khoáng chất trong 100g mề gà cũng chứa nhiều hàm lượng vitamin E B12 Canxi Sắt Magie Kẽm đều là các chất cần thiết cho quá trình sản xuất hồng cầu bổ sung dinh dưỡng cho người đang mệt mỏi Theo nghiên cứu thì 1 khẩu phần mề gà có chứa 6 nhu cầu vitamin C hằng ngày 1 vitamin A 1 Canxi Natri Kali mề gà có khoảng 69mg Natri và 179mg Kali trong 100g nên hoàn toàn không ảnh hưởng đến sức khỏe Bên cạnh đó mề gà cũng chứa nhiều thành phần khác nữa nhé Mề gà làm món gì ngon Mề gà nướng sả ớt
https://vinmart.co/loi-nac-vai-bo-my-bao-beef-topblade-t95973580.html,Lõi nạc vai bò Mỹ bào Beef Topblade,Taiducfood,229500,Đang cập nhật,Không có,Giới thiệu Lõi nạc vai bò Mỹ bào Beef Topblade Lõi nạc vai bò Mỹ bào 500g Beef Topblade
https://vinmart.co/dui-canh-ga-c-p-500gr-t116102461.html,Đùi cánh gà C P 500gr,E Mall,90000,Đang cập nhật,Không có,Giới thiệu Đùi cánh gà C P 500gr Với sản phẩm tươi sống trọng lượng thực tế có thể chênh lệch khoảng 10 Thịt gà chứa nhiều chất dưỡng chất có lợi cho sức khoẻ Đồng thời loại thịt này còn có thể chế biến thành rất nhiều món ăn ngon như hấp la gu rô ti cà riTheo các nhà dinh dưỡng học ngoài những chất albumin chất béo thịt gà còn có các vitamin A B1 B2 C E axit canxi photpho sắt Đóng gói 500gr
https://vinmart.co/suon-cuu-cat-kieu-phap-lamb-rack-frenhed-cut-1-1-2kg-mieng-t167438238.html,Sườn cừu cắt kiểu pháp lamb rack frenhed cut 1 1 2kg miếng,Taiducfood,990000,Đang cập nhật,Không có,Giới thiệu Sườn cừu cắt kiểu pháp lamb rack frenhed cut 1 1 2kg miếng Với sản phẩm tươi sống trọng lượng thực tế có thể chênh lệch khoảng 10 Sườn cừu cắt kiểu pháp lamb rack frenhed cut 1 1 2kg miếng
https://vinmart.co/thit-than-ngoai-bo-uc-beef-striploin-aus-t95973602.html,Thịt thăn ngoại bò Úc Beef Striploin Aus,Taiducfood,184500,Đang cập nhật,Không có,Giới thiệu Thịt thăn ngoại bò Úc Beef Striploin Aus Thăn ngoại bò Úc BBQ 400 500g Beef Striploin Aus
https://vinmart.co/chan-ga-cp-500gr-t116493389.html,Chân gà CP 500gr,E Mall,70000,Đang cập nhật,Không có,Giới thiệu Chân gà CP 500gr Với sản phẩm tươi sống trọng lượng thực tế có thể chênh lệch khoảng 10 Thịt gà chứa nhiều chất dưỡng chất có lợi cho sức khoẻ Đồng thời loại thịt này còn có thể chế biến thành rất nhiều món ăn ngon như hấp la gu rô ti cà riTheo các nhà dinh dưỡng học ngoài những chất albumin chất béo thịt gà còn có các vitamin A B1 B2 C E axit canxi photpho sắt Đóng gói 500gr
https://vinmart.co/luon-ngong-xong-khoi-nga-200-250g-mieng-t172169413.html,Lườn ngỗng xông khói Nga 200 250g miếng,Taiducfood Mart Lê Văn Thịnh,65000,Đang cập nhật,Không có,Giới thiệu Lườn ngỗng xông khói Nga 200 250g miếng Với sản phẩm tươi sống trọng lượng thực tế có thể chênh lệch khoảng 10 Lườn Ngỗng Xông Khói Nga 1 miếng 200 250g Smoked Goose Breast
https://vinmart.co/set-bo-nuong-song-600gr-t85929600.html,Set Bò Nướng Sống 600gr,Bà Bông Market,225000,Đang cập nhật,Không có,Giới thiệu Set Bò Nướng Sống 600gr Với sản phẩm tươi sống trọng lượng thực tế có thể chênh lệch khoảng 10 Sản phẩm tươi sống
https://vinmart.co/dui-ga-thao-khop-cp-500gr-t116493150.html,Đùi gà tháo khớp CP 500gr,E Mall,90000,Đang cập nhật,Không có,Giới thiệu Đùi gà tháo khớp CP 500gr Với sản phẩm tươi sống trọng lượng thực tế có thể chênh lệch khoảng 10 Thịt gà chứa nhiều chất dưỡng chất có lợi cho sức khoẻ Đồng thời loại thịt này còn có thể chế biến thành rất nhiều món ăn ngon như hấp la gu rô ti cà riTheo các nhà dinh dưỡng học ngoài những chất albumin chất béo thịt gà còn có các vitamin A B1 B2 C E axit canxi photpho sắt Đóng gói 500gr
https://vinmart.co/dui-cuu-khong-xuong-500gram-t174511165.html,Đùi Cừu không xương 500gram,THỰC PHẨM FINE FOOD,261000,Đang cập nhật,Không có,Giới thiệu Đùi Cừu không xương 500gram Với sản phẩm tươi sống trọng lượng thực tế có thể chênh lệch khoảng 10 Đùi cừu Úc không xương BBQ Fine Food được đóng gói dưới dạng khay tiện lợi vô cùng thịt cừu đảm bảo 100 từ Úc thịt mềm ngon và mọng nước là một trong những nguyên liệu được các chị em nội trợ ưa chuộng và tin dùng hàng đầu Trọng lượng 500 gram Bảo quản Ngăn đá tủ lạnh Hạn sử dụng 12 tháng từ ngày đóng gói HDSD Nấu chín trước khi dùng
https://vinmart.co/thit-loi-vai-bo-my-mieng-beefsteak-top-blade-usa-500gr-t85829299.html,Thịt Lõi Vai Bò Mỹ miếng beefsteak Top Blade USA 500gr,Bà Bông Market,195000,Đang cập nhật,Không có,Giới thiệu Thịt Lõi Vai Bò Mỹ miếng beefsteak Top Blade USA 500gr Với sản phẩm tươi sống trọng lượng thực tế có thể chênh lệch khoảng 10 Thịt lõi vai bò Mỹ nhập khẩu tươi sống 
https://vinmart.co/canh-giua-ga-c-p-500gr-t116102431.html,Cánh giữa gà C P 500gr,E Mall,100000,Đang cập nhật,Không có,Giới thiệu Cánh giữa gà C P 500gr Với sản phẩm tươi sống trọng lượng thực tế có thể chênh lệch khoảng 10 Thịt gà chứa nhiều chất dưỡng chất có lợi cho sức khoẻ Đồng thời loại thịt này còn có thể chế biến thành rất nhiều món ăn ngon như hấp la gu rô ti cà riTheo các nhà dinh dưỡng học ngoài những chất albumin chất béo thịt gà còn có các vitamin A B1 B2 C E axit canxi photpho sắt Đóng gói 500gr
https://vinmart.co/1-kg-nai-phi-le-ngon-re-hoa-toc-2h-hcm-t181002236.html,1 Kg Nai Phi Lê Ngon Rẻ Hỏa Tốc 2H HCM ,Cô Hai Food,109000,Đang cập nhật,Không có,Giới thiệu 1 Kg Nai Phi Lê Ngon Rẻ Hỏa Tốc 2H HCM Với sản phẩm tươi sống trọng lượng thực tế có thể chênh lệch khoảng 10 ĂN LÀ MÊ CHÊ KHÔNG TÍNH TIỀN ĐĂ C SA N 4 MU A CÔ HAI Nguồn gốc Nai trang trại Khánh Hòa trang trại Bình Phước Thịt tươi sơ chế bao gói cấp đông sâu Tiêu chuẩn an toàn thực phẩm Thịt nai tính mát lành bổ dưỡng Chế biến dễ dàng là món nhậu cực kỳ tuyệt tác Chế biến dễ dàng là món ăn chống ngán món nhậu cực kỳ tuyệt vời Món thịt Nai chấm với mắm nêm muối tiêu chanh nước mắm đều rất hợp Món thịt Nai chấm với tương hạt xay mắm nêm muối tiêu chanh đều rất hợp Nai nhúng dấm Thái mỏng ướp gia vị dầu hào dầu mè gừng xả ớt Nai xào sả ớt gia vị món xào có thêm chút ngũ vị hương cho dậy mùi Nai hấp gia vị bột nêm xì dầu dầu hào dầu mè ướp 30 Hấp trong nồi sả gừng 15 25 tùy miếng kích cỡ miếng thịt Nai nướng lá lốt miếng mỏng ướp gia vị cuốn lá lốt nướng trên lửa hồng kẹp rau sống gia vị và chấm tương
https://vinmart.co/thit-co-bo-my-mvp-khay-350g-t53793433.html,Thịt cổ bò Mỹ MVP khay 350g,CỬA HÀNG THỰC PHẨM MEGADELI,189000,Đang cập nhật,Không có,Giới thiệu Thịt cổ bò Mỹ MVP khay 350g Với sản phẩm tươi sống trọng lượng thực tế có thể chênh lệch khoảng 10 Thịt cổ bò Mỹ MVP khay 350g nhập khẩu trực tiếp từ Mỹ 100 cắt và đóng gọi tại Nhà Máy MEGADELI KCN Long Hậu Gói thịt có thể dễ dàng dữ trữ Khi sử dụng bạn chỉ cần rã đông là có thể dùng ngay Giá trị dinh dưỡng Duy trì cơ bắp Nâng cao hiệu suất tập thể dục Phòng chống thiếu máu Tiêu chuẩn và chứng nhận chất lượng Đạt chứng nhận chất lượng VSATTP và HACCP Thành phần 100 bò Mỹ Hướng dẫn sử dụng Rã đông tự nhiên hoặc bằng lò vi sóng nấu chín trước khi sử dụng ngon nhất cho món nướng Món ngon đề xuất Nướng BBQ Salad bò rau xanh
https://vinmart.co/tim-ga-cp-sach-500gr-t116102441.html,Tim gà CP sạch 500gr,E Mall,90000,Đang cập nhật,Không có,Giới thiệu Tim gà CP sạch 500gr Với sản phẩm tươi sống trọng lượng thực tế có thể chênh lệch khoảng 10 
