https://vinmart.co/luon-ngong-nga-xong-khoi-1-mieng-t107607790.html,Lườn Ngỗng Nga Xông Khói 1 Miếng,Phucloi Foods,55000,Đang cập nhật,Không có,Giới thiệu Lườn Ngỗng Nga Xông Khói 1 Miếng Với sản phẩm tươi sống trọng lượng thực tế có thể chênh lệch khoảng 10 Thịt ngỗng được đánh giá là cung cấp chất béo và nguồn dinh dưỡng nhiều nhất cho cơ thể người Ngoài ra thịt ngỗng và thịt vịt có thành phần hóa học rất giống dầu ô liu cực kỳ có ích cho sức khỏe nhất là tim mạch Lườn ngỗng xông hun khói là khối thịt dày nằm 2 bên dưới sườn ngỗng được tách ra đem chế biến hun khói theo công thức đặc biệt để tạo ra món ăn được giới ẩm thực ưa chuộng Rất hợp dùng trong các bữa nhậu ăn đồ nguội liên hoan tiệc làm quà biếu hay mang theo đi du lịch 
https://vinmart.co/loi-nac-vai-bo-my-bittet-beef-topblade-t95973535.html,Lõi nạc vai bò Mỹ bittet Beef Topblade,Taiducfood,229500,Đang cập nhật,Không có,Giới thiệu Lõi nạc vai bò Mỹ bittet Beef Topblade Lõi nạc vai bò Mỹ bittet 400 500g Beef Topblade
https://vinmart.co/chan-ga-500g-t92097631.html,Chân gà 500g,Shop Quoc Thinh Foods,40000,Đang cập nhật,Không có,Giới thiệu Chân gà 500g Với sản phẩm tươi sống trọng lượng thực tế có thể chênh lệch khoảng 10 Công ty TNHH Thực Phẩm Quốc Thịnh chuyên nhập khẩu các loại thịt đông lạnh và thịt tươi như cá bò heo gà cừu trâu và hải sản từ khắp các nước trên Thế Giới như Mỹ Canada Brazil Tây Ban Nha BaLan Pháp Nga úng tôi phân phối trên toàn quốc Shop cam kết 100 sản phẩm được nhập khẩu chính ngạch đầy đủ các chứng từ nhập khẩu giấy phép nhập khẩu giấy chứng nhận ATVSTP Shop có cắt thái theo yêu cầu của quý khách vui lòng nhắn tin cho shop để được hỗ trợ nhé Nếu bạn là người của tỉnh khác có nhu cầu mua khối lượng lớn hoặc cần biết nhiều thông tin hơn liên hệ 091 876 9998 Fanpage Quoc Thinh Foods Cửa hàng 148 150 Song Hành KĐT Lakeview City Phường An Phú Quận 2 TP HCM thitheo thitbo thitbouc thitbomy đùigà canhga thitheo baroi bachi cotlet monngon bep nauan thitbosach quocthinh quocthinhfoods food thitnhapkhau thitbonhapkhau thitheonhapkhau
https://vinmart.co/than-noi-trau-ms31-cat-khoi-tui-500gr-t127447546.html,Thăn nội trâu MS31 cắt khối Túi 500gr,QUÂN ANH FOOD,125000,Đang cập nhật,Không có,Giới thiệu Thăn nội trâu MS31 cắt khối Túi 500gr Với sản phẩm tươi sống trọng lượng thực tế có thể chênh lệch khoảng 10 Thịt trâu Ấn nhập khẩu Đóng gói túi 500gr hút chân không Bảo quản 18 độ C HDSD rã đông và làm chín trước khi dùng Dùng nấu lẩu làm thịt tá nhúng mẻ xào 
https://vinmart.co/thit-ba-chi-bo-my-cat-mong-short-plate-usa-500gr-t85874228.html,Thịt Ba Chỉ Bò Mỹ cắt mỏng short Plate USA 500gr,Bà Bông Market,150000,Đang cập nhật,Không có,Giới thiệu Thịt Ba Chỉ Bò Mỹ cắt mỏng short Plate USA 500gr Với sản phẩm tươi sống trọng lượng thực tế có thể chênh lệch khoảng 10 Thịt Ba Chỉ Bò nhập khẩu Mỹ bảo đảm tươi sống
https://vinmart.co/ga-go-cong-1-2-con-800gr-t65117182.html,Gà Gò Công 1 2 con 800gr,E Mall,165000,Đang cập nhật,Không có,Giới thiệu Gà Gò Công 1 2 con 800gr Với sản phẩm tươi sống trọng lượng thực tế có thể chênh lệch khoảng 10 Gà ta Gò Công Được nuôi theo tiêu chuẩn VietGap Trong quá trình chăn nuôi phải tuân thủ đầy đủ các quy tắc từ lựa chọn gà giống nguồn thực phẩm nước uống nhiệt độ môi trường sống của gà Đặc biệt gà phải được tiêm phòng vắc xin và phun thuốc phòng dịch bệnh chuồng trại đầy đủ theo đúng lịch trình Gà sẽ được cho ăn đầy đủ vào ban ngày nhưng không cho ăn vào ban đêm để tạo độ miễn dịch tốt giúp tăng trọng lượng đều chất lượng thịt thơm ngon Hàng tháng gà được kiểm tra kháng thể H5N1 và kháng thể dịch bệnh tả Được các cơ quan chuyên môn kiểm tra đánh giá và công nhận là giống mới có chất lượng quản lý tốt và việc truy xuất nguồn gốc hết sức nghiêm ngặt đảm bảo cung cấp đủ lượng gà giống sạch bệnh cho người chăn nuôi cung ứng gà thịt thương phẩm đạt tiêu chuẩn ATVSTP được thị trường hết sức ưa chuộng Không sử dụng thuốc khích thích thuốc tăng trưởng thức ăn hoàn toàn tự nhiên như cám ngô lúa thóc Vì thế nên gà ta gò công cực kỳ sạch thơm ngon đầy chất dinh dưỡng Gà đã được làm sạch cấp đông hút chân không giữ được độ dinh dưỡng và độ tươi ngon 99 như ban đầu Gà ta Gò Công Hàm lượng protein trong thịt gà cao hơn các loại thịt khác và lại là có hàm lượng chất béo thấp nhất thịt gà thường xuyên nằm trong thực đơn của những người tập thể hình ăn kiêng cần bố sung chất dinh dưỡng Bảo quản trong tủ đông từ 10 độ C đến 20 độ C sử dụng trong vòng 6 tháng Cách sử dụng Rã đông trước khi dùng không nên cấp đông lại sau khi đã rã Dùng để chiên luộc rán nấu
https://vinmart.co/ech-size-4con-kg-1kg-t128332519.html,Ếch size 4con kg 1kg,Hải sản Khải Hưng Bình Điền,95000,Đang cập nhật,Không có,Giới thiệu Ếch size 4con kg 1kg Với sản phẩm tươi sống trọng lượng thực tế có thể chênh lệch khoảng 10 Giá tiền sản phẩm tính trên 1kg
https://vinmart.co/gan-bo-uc-beef-hocktendon-t95973330.html,Gân Bò Úc Beef hocktendon,Taiducfood,139500,Đang cập nhật,Không có,Giới thiệu Gân Bò Úc Beef hocktendon Gân Bò Úc 500g Beef hocktendon
https://vinmart.co/sun-goi-ga-nhap-khau-bich-2kg-t107856542.html,Sụn Gối Gà Nhập Khẩu Bịch 2kg,Shop Quoc Thinh Foods,440000,Đang cập nhật,Không có,Giới thiệu Sụn Gối Gà Nhập Khẩu Bịch 2kg Với sản phẩm tươi sống trọng lượng thực tế có thể chênh lệch khoảng 10 Công ty TNHH Thực Phẩm Quốc Thịnh chuyên nhập khẩu các loại thịt đông lạnh và thịt tươi như cá bò heo gà cừu trâu và hải sản từ khắp các nước trên Thế Giới như Mỹ Canada Brazil Tây Ban Nha BaLan Pháp Nga úng tôi phân phối trên toàn quốc Shop cam kết 100 sản phẩm được nhập khẩu chính ngạch đầy đủ các chứng từ nhập khẩu giấy phép nhập khẩu giấy chứng nhận ATVSTP Shop có cắt thái theo yêu cầu của quý khách vui lòng nhắn tin cho shop để được hỗ trợ nhé Nếu bạn là người của tỉnh khác có nhu cầu mua khối lượng lớn hoặc cần biết nhiều thông tin hơn liên hệ 091 876 9998 Fanpage Quoc Thinh Foods Cửa hàng 148 150 Song Hành KĐT Lakeview City Phường An Phú Quận 2 TP HCM thitheo thitbo thitbouc thitbomy đùigà canhga thitheo baroi bachi cotlet monngon bep nauan thitbosach quocthinh quocthinhfoods food thitnhapkhau thitbonhapkhau thitheonhapkhau
https://vinmart.co/combo-bun-bo-1kg-nam-trau-1kg-dung-heo-1kg-suon-que-t128596929.html,Combo bún bò 1kg Nạm trâu 1kg dựng heo 1kg sườn que,QUÂN ANH FOOD,260000,Đang cập nhật,Không có,Giới thiệu Combo bún bò 1kg Nạm trâu 1kg dựng heo 1kg sườn que Với sản phẩm tươi sống trọng lượng thực tế có thể chênh lệch khoảng 10 Gồm 1kg Nạm trâu 1kg dựng heo 1kg sườn que
https://vinmart.co/ba-chi-bo-my-cuon-beef-shortblade-usa-t95973220.html,Ba chỉ bò Mỹ cuộn beef shortblade USA,Taiducfood,135000,Đang cập nhật,Không có,Giới thiệu Ba chỉ bò Mỹ cuộn beef shortblade USA Ba chỉ bò Mỹ cuộn 500g beef short plate USA
https://vinmart.co/dui-ga-goc-tu-leg-quarter-600gram-t114198936.html,Đùi Gà Góc Tư Leg Quarter 600gram,THỰC PHẨM FINE FOOD,80000,Đang cập nhật,Không có,Giới thiệu Đùi Gà Góc Tư Leg Quarter 600gram Với sản phẩm tươi sống trọng lượng thực tế có thể chênh lệch khoảng 10 Tên SP Đùi Gà Góc Tư Leg Quarter Ma SP Code CK 02 Xuâ t xư Nhập khẩu Tro ng lươ ng 15 kg thu ng Leg Quarter Đu i ga go c tư nươ ng Hướng dẫn chế biến Sa n phâ m Leg Quarter Đu i ga go c tư tiê n du ng co thê nươ ng xa o chiên đu t lo 
https://vinmart.co/cot-let-cuu-uc-lamb-shortloin-t96515808.html,Cốt lết cừu úc Lamb shortloin,Taiducfood,219500,Đang cập nhật,Không có,Giới thiệu Cốt lết cừu úc Lamb shortloin Cốt lết cừu úc Lamb shortloin
https://vinmart.co/bap-hoa-bo-my-t90590820.html,Bắp Hoa Bò Mỹ,Shop Quoc Thinh Foods,220000,Đang cập nhật,Không có,Giới thiệu Bắp Hoa Bò Mỹ Nhúng lẫu cuốn bánh tráng hầm khoai tây Hầm thuốc bắc hấp gừng trộn chua ngọt
https://vinmart.co/dui-toi-ga-drumstick-chicken-500gram-t113921152.html,Đùi Tỏi Gà Drumstick chicken 500gram,THỰC PHẨM FINE FOOD,74000,Đang cập nhật,Không có,Giới thiệu Đùi Tỏi Gà Drumstick chicken 500gram Với sản phẩm tươi sống trọng lượng thực tế có thể chênh lệch khoảng 10 Tên SP Đùi Tỏi Gà Drumstick chicken Ma SP Code CK 03 Xuâ t xư Nhập khẩu Tro ng lươ ng 15 kg thu ng Drumstick Đu i to i ga Hướng dẫn chế biến Sa n phâ m Drumstick Đu i to i ga co thê nươ ng xa o chiên đu t lo 
https://vinmart.co/suon-cuu-uc-1kg-t129409675.html,SƯỜN CỪU ÚC 1KG,gobeef,539000,Đang cập nhật,Không có,Giới thiệu SƯỜN CỪU ÚC 1KG Với sản phẩm tươi sống trọng lượng thực tế có thể chênh lệch khoảng 10 Thịt cừu Úc là một loại thực phẩm thơm ngon cực kỳ nhiều chất dinh dưỡng Sườn cừu Úc có xương là phần thịt dày gân giòn Sườn được chia nhỏ thành nhiều nan rất tiện lợi cho việc chế biến và bảo quản Sườn cừu Úc là thực phẩm nhiều đạm mang đến giá trị dinh dưỡng cao cung cấp chất sắt làm bổ máu cải thiện khả năng ghi nhớ và tập trung của não Lượng kẽm trong sườn cừu Úc có xương có tác dụng giúp cơ thể chống bệnh nhiễm trùng Tỷ lệ cao Vitamin B3 B12 tạo thêm hồng cầu giảm cholesterol và Vitamin D trong sườn cừu giúp ngăn ngừa loãng xương Thịt cừu có vị đặc trưng riêng không lẫn vào đâu được Nó gần giống thịt dê và hoàn toàn khác với thịt bò Mỹ thịt bò Úc Xuất xứ Úc Thương hiệu Midfield Bào quản 18 độ C hoặc để ngăn đông của tủ lạnh Đóng gói Thường cắt miếng 1 5cm đóng khay 500g Có cắt đóng gói hút chân không theo yêu cầu miễn phí Chế biến Nướng quay hầm 
https://vinmart.co/dau-than-ngoai-uc-t90590815.html,Đầu Thăn Ngoại Úc,Shop Quoc Thinh Foods,225000,Đang cập nhật,Không có,Giới thiệu Đầu Thăn Ngoại Úc Công ty TNHH Thực Phẩm Quốc Thịnh chuyên nhập khẩu các loại thịt đông lạnh và thịt tươi như cá bò heo gà cừu trâu và hải sản từ khắp các nước trên Thế Giới như Mỹ Canada Brazil Tây Ban Nha BaLan Pháp Nga chúng tôi phân phối trên toàn quốc Shop cam kết 100 sản phẩm được nhập khẩu chính ngạch đầy đủ các chứng từ nhập khẩu giấy phép nhập khẩu giấy chứng nhận ATVSTP Shop có cắt thái theo yêu cầu của quý khách vui lòng nhắn tin cho shop để được hỗ trợ nhé Nếu bạn là người của tỉnh khác có nhu cầu mua khối lượng lớn hoặc cần biết nhiều thông tin hơn liên hệ 091 876 9998 Fanpage Quoc Thinh Foods Cửa hàng 148 150 Song Hành KĐT Lakeview City Phường An Phú Quận 2 TP HCM thitheo thitbo thitbouc thitbomy đùigà canhga thitheo baroi bachi cotlet monngon bep nauan thitbosach quocthinh quocthinhfoods food thitnhapkhau thitbonhapkhau thitheonhapkhau
https://vinmart.co/canh-ga-khuc-giua-chicken-wing-500gram-t113921188.html,Cánh gà khúc giữa Chicken wing 500gram,THỰC PHẨM FINE FOOD,80000,Đang cập nhật,Không có,Giới thiệu Cánh gà khúc giữa Chicken wing 500gram Với sản phẩm tươi sống trọng lượng thực tế có thể chênh lệch khoảng 10 Tên SP Chicken wing Ca nh ga Ma SP Code CK 05 Xuâ t xư Mỹ Tro ng lươ ng 15 kg thu ng Bảo quản ngăn đá tủ lạnh Hạn sử dụng 12 tháng kể từ ngày đóng gói Chicken wing Ca nh ga Hướng dẫn chế biến Sa n phâ m Chicken wing Ca nh ga co thê nươ ng chiên đu t lo 
https://vinmart.co/dui-ech-tuoi-50-60g-con-1kg-t129575726.html,Đùi ếch tươi 50 60g con 1kg,Hải sản Khải Hưng Bình Điền,170000,Đang cập nhật,Không có,Giới thiệu Đùi ếch tươi 50 60g con 1kg Với sản phẩm tươi sống trọng lượng thực tế có thể chênh lệch khoảng 10 Đùi ếch tươi làm sạch kích cỡ 50 60g cái Cửa hàng có hỗ trợ sơ chế sản phẩm nếu KH có yêu cầu KH có thể ghi chú khi đặt hàng hoặc báo khi CH gọi xác nhận đơn
https://vinmart.co/than-ngoai-bo-uc-meltique-mvp-tui-200g-t53791708.html,Thăn ngoại bò Úc Meltique MVP túi 200g,CỬA HÀNG THỰC PHẨM MEGADELI,229000,Đang cập nhật,Không có,Giới thiệu Thăn ngoại bò Úc Meltique MVP túi 200g Với sản phẩm tươi sống trọng lượng thực tế có thể chênh lệch khoảng 10 Thăn ngoại bò Úc Meltique MVP túi 250g nhập khẩu trực tiếp từ Úc 100 cắt và đóng gọi tại Nhà Máy MEGADELI KCN Long Hậu Gói thịt có thể dễ dàng dữ trữ Khi sử dụng bạn chỉ cần rã đông là có thể dùng ngay Giá trị dinh dưỡng Duy trì cơ bắp Nâng cao hiệu suất tập thể dục Phòng chống thiếu máu Tiêu chuẩn và chứng nhận chất lượng Đạt chứng nhận chất lượng VSATTP và HACCP Thành phần 100 bò Úc Hướng dẫn sử dụng Rã đông tự nhiên hoặc bằng lò vi sóng nấu chín trước khi sử dụng ngon nhất cho món nướng Món ngon đề xuất Nướng BBQ Salad bò rau xanh
https://vinmart.co/canh-ga-khuc-giua-ban-lan-loai-i-1kg-t107405779.html,Cánh gà khúc giữa Ban Lan loại I 1kg,THỰC PHẨM TUẤN VINA,99000,Đang cập nhật,Không có,Giới thiệu Cánh gà khúc giữa Ban Lan loại I 1kg Cánh gà khúc giữa Ban Lan loại I Quy cách đóng gói 1 khay 500g
https://vinmart.co/than-ngoai-trau-an-do-cat-khuc-buffalo-leg-boneless-500g-t134347405.html,Thăn ngoại trâu Ấn độ cắt khúc _ Buffalo Leg boneless 500g,Taiducfood,94500,Đang cập nhật,Không có,Giới thiệu Thăn ngoại trâu Ấn độ cắt khúc _ Buffalo Leg boneless 500g Với sản phẩm tươi sống trọng lượng thực tế có thể chênh lệch khoảng 10 Thăn ngoạitrâu Ấn độ cắt khúc _ Buffalo Leg boneless 500g
https://vinmart.co/thit-co-bo-va-ba-roi-bo-my-mvp-khay-500g-t53829089.html,Thịt cổ bò và ba rọi bò Mỹ MVP khay 500g,CỬA HÀNG THỰC PHẨM MEGADELI,225000,Đang cập nhật,Không có,Giới thiệu Thịt cổ bò và ba rọi bò Mỹ MVP khay 500g Với sản phẩm tươi sống trọng lượng thực tế có thể chênh lệch khoảng 10 Thịt cổ bò và ba rọi bò Mỹ MVP khay 500g nhập khẩu trực tiếp từ Mỹ 100 cắt và đóng gọi tại Nhà Máy MEGADELI KCN Long Hậu Gói thịt có thể dễ dàng dữ trữ Khi sử dụng bạn chỉ cần rã đông là có thể dùng ngay Giá trị dinh dưỡng Duy trì cơ bắp Nâng cao hiệu suất tập thể dục Phòng chống thiếu máu Tiêu chuẩn và chứng nhận chất lượng Đạt chứng nhận chất lượng VSATTP và HACCP Thành phần 100 bò Mỹ Hướng dẫn sử dụng Rã đông tự nhiên hoặc bằng lò vi sóng nấu chín trước khi sử dụng ngon nhất cho món nướng Món ngon đề xuất Nướng BBQ Lẩu
https://vinmart.co/dui-ga-toi-1kg-t114863760.html,Đùi gà tỏi 1kg ,Thực phẩm cao cấp H And H,75000,Đang cập nhật,Không có,Giới thiệu Đùi gà tỏi 1kg Với sản phẩm tươi sống trọng lượng thực tế có thể chênh lệch khoảng 10 Đùi tỏi gà đông lạnh tươi ngon Nhập khẩu Mỹ Đóng gói vỉ 1kg 4 5 cái kg 
https://vinmart.co/tuy-xuong-trau-an-do-frozen-halal-buffalo-marrow-500g-t138958316.html,Tuỷ xương trâu Ấn Độ Frozen Halal buffalo Marrow 500g,Taiducfood,154500,Đang cập nhật,Không có,Giới thiệu Tuỷ xương trâu Ấn Độ Frozen Halal buffalo Marrow 500g Với sản phẩm tươi sống trọng lượng thực tế có thể chênh lệch khoảng 10 Tuỷ xương trâu Ấn Độ Frozen Halal buffalo Marrow 500g
https://vinmart.co/loi-vai-bo-my-1kg-t102895895.html,Lõi Vai Bò Mỹ 1KG,Thực phẩm cao cấp H And H,380000,Đang cập nhật,Không có,Giới thiệu Lõi Vai Bò Mỹ 1KG Với sản phẩm tươi sống trọng lượng thực tế có thể chênh lệch khoảng 10 Tươi ngon
https://vinmart.co/uc-ga-phi-le-dong-lanh-cp-loai-500g-t79379667.html,Ức gà phi lê đông lạnh CP Loại 500g,Thực Phẩm Nhanh,58000,Đang cập nhật,Không có,Giới thiệu Ức gà phi lê đông lạnh CP Loại 500g Với sản phẩm tươi sống trọng lượng thực tế có thể chênh lệch khoảng 10 Thịt gà CP được xử lý hoàn toàn khép kín bảo đảm an toàn thực phẩm chất lượng sản phẩm cao 
https://vinmart.co/than-noi-trau-fillet-bo-31-cat-luc-lac-t141011346.html,Thăn nội trâu Fillet bò 31 cắt lúc lắc,QUÂN ANH FOOD,245000,Đang cập nhật,Không có,Giới thiệu Thăn nội trâu Fillet bò 31 cắt lúc lắc Thăn nội trâu Fillet bò 31 
https://vinmart.co/ba-chi-bo-my-cat-nuong-beef-shortplade-t95973225.html,Ba chỉ bò Mỹ cắt nướng beef shortplade,Taiducfood,135000,Đang cập nhật,Không có,Giới thiệu Ba chỉ bò Mỹ cắt nướng beef shortplade Ba chỉ bò Mỹ cắt nướng 500g beef shortplade USA
https://vinmart.co/canh-ga-dong-lanh-cp-500g-t96198585.html,Cánh gà đông lạnh CP 500g,Thực Phẩm Nhanh,64000,Đang cập nhật,Không có,Giới thiệu Cánh gà đông lạnh CP 500g Với sản phẩm tươi sống trọng lượng thực tế có thể chênh lệch khoảng 10 Thực Phẩm Nhanh thucphamnhanh Thực Phẩm Nhanh cung cấp đầy đủ các loại nguyên liệu tươi dùng để nấu một bữa cơm tươm tất cho khách hàng Sản phẩm của chúng tôi đa dạng từ rau củ quả thịt heo thịt bò thịt gà trứng gia cầm sữa và thủy hải sản đến các sản phẩm đặc sản vùng miền với giấy chứng nhận vệ sinh an toàn Thực Phẩm của Ban quản lý an toàn Thực phẩm Thành phố Hồ Chí Minh giấy kiểm dịch giấy công bố chất lượng của sản phẩm Tất cả sản phẩm đều được lựa chọn và bảo quản nghiêm ngặt Thực Phẩm Nhanh tự hào là một trong những đơn vị đầu tiên cung cấp dịch vụ đi chợ online đem đến cho mọi gia đình bữa ăn đầy đủ dinh dưỡng đảm bảo an toàn và nâng cao giá trị cuộc sống với những món ăn ngon chất lượng Thực Phẩm Nhanh cam kết sẽ giao hàng nhanh nhất đến tay khách hàng 
https://vinmart.co/thit-cang-cua-bien-tuoi-yummi-one-150g-8938507930082-t128323186.html,Thịt càng cua biển tươi Yummi One 150g 8938507930082 ,Lotte Mart Quận 7,224900,Đang cập nhật,Không có,Giới thiệu Thịt càng cua biển tươi Yummi One 150g 8938507930082 Với sản phẩm tươi sống trọng lượng thực tế có thể chênh lệch khoảng 10 Khác hẳn các loại thịt thịt cua là loại có chưa rất nhiều protein và đặc biệt là dễ tiêu hóa hơn các loại thịt khác nên đây là một loại thực phẩm rất tốt cho sức khỏe con người 
https://vinmart.co/loi-vai-bo-uc-500g-t90728252.html,Lõi Vai Bò Úc 500g,Shop Quoc Thinh Foods,165000,Đang cập nhật,Không có,Giới thiệu Lõi Vai Bò Úc 500g Với sản phẩm tươi sống trọng lượng thực tế có thể chênh lệch khoảng 10 Công ty TNHH Thực Phẩm Quốc Thịnh chuyên nhập khẩu các loại thịt đông lạnh và thịt tươi như cá bò heo gà cừu trâu và hải sản từ khắp các nước trên Thế Giới như Mỹ Canada Brazil Tây Ban Nha BaLan Pháp Nga chúng tôi có phân phối trên toàn quốc Shop cam kết 100 sản phẩm được nhập khẩu chính ngạch đầy đủ các chứng từ nhập khẩu giấy phép nhập khẩu giấy chứng nhận ATVSTP Shop có cắt thái theo yêu cầu của quý khách vui lòng nhắn tin cho shop để được hỗ trợ nhé Nếu bạn là người của tỉnh khác có nhu cầu mua khối lượng lớn hoặc cần biết nhiều thông tin hơn liên hệ 091 876 9998 Fanpage Quoc Thinh Foods Cửa hàng 148 150 Song Hành KĐT Lakeview City Phường An Phú Quận 2 TP HCM thitheo thitbo thitbouc thitbomy đùigà canhga thitheo baroi bachi cotlet monngon bep nauan thitbosach quocthinh quocthinhfoods food thitnhapkhau thitbonhapkhau thitheonhapkhau
https://vinmart.co/long-ga-dong-lanh-cp-loai-500g-t96468842.html,Lòng gà đông lạnh CP Loại 500g,Thực Phẩm Nhanh,45000,Đang cập nhật,Không có,Giới thiệu Lòng gà đông lạnh CP Loại 500g Với sản phẩm tươi sống trọng lượng thực tế có thể chênh lệch khoảng 10 Thực Phẩm Nhanh thucphamnhanh Thực Phẩm Nhanh cung cấp đầy đủ các loại nguyên liệu tươi dùng để nấu một bữa cơm tươm tất cho khách hàng Sản phẩm của chúng tôi đa dạng từ rau củ quả thịt heo thịt bò thịt gà trứng gia cầm sữa và thủy hải sản đến các sản phẩm đặc sản vùng miền với giấy chứng nhận vệ sinh an toàn Thực Phẩm của Ban quản lý an toàn Thực phẩm Thành phố Hồ Chí Minh giấy kiểm dịch giấy công bố chất lượng của sản phẩm Tất cả sản phẩm đều được lựa chọn và bảo quản nghiêm ngặt Thực Phẩm Nhanh tự hào là một trong những đơn vị đầu tiên cung cấp dịch vụ đi chợ online đem đến cho mọi gia đình bữa ăn đầy đủ dinh dưỡng đảm bảo an toàn và nâng cao giá trị cuộc sống với những món ăn ngon chất lượng Thực Phẩm Nhanh cam kết sẽ giao hàng nhanh nhất đến tay khách hàng 
https://vinmart.co/hcm-nam-bung-trau-1-kg-giao-nhanh-tphcm-t152020428.html,HCM Nạm bụng trâu 1 kg Giao nhanh TPHCM ,TOPMEAL,118000,Đang cập nhật,Không có,Giới thiệu HCM Nạm bụng trâu 1 kg Giao nhanh TPHCM Với sản phẩm tươi sống trọng lượng thực tế có thể chênh lệch khoảng 10 Các sản phẩm thịt cá hải sản của TOPMEAL là thực phẩm đông lạnh được nhập khẩu với số lượng lớn từ các nước có uy tín trên thế giới như Anh Đức Nga Italia Ba Lan Áo Hà Lan Tây Ban Nha Tất cả đều đã được kiểm dịch có hóa đơn chứng từ và chứng nhận vệ sinh an toàn thực phẩm đầy đủ Lưu ý Khi hàng hóa được giao đến nếu phát hiện sai hàng thiếu hàng hoặc sản phẩm có vấn đề về chất lượng Quý khách vui lòng chụp hình đơn hàng giao đến và phản hồi về cho TOPMEAL qua cổng chat trong vòng 24 giờ Shop sẽ giải quyết thỏa đáng cho khách hàng Đừng vội đánh giá 1 3 sao khi chưa được TOPMEAL giải quyết khách nhé TOPMEAL chân thành cảm ơn sự ủng hộ của Quý khách Chúc Quý khách thật nhiều sức khỏe và có những bữa ăn ngon miệng cùng TOPMEAL 
https://vinmart.co/hokubee-uc-than-ngoai-bo-hokubee-oval-1kg-t103557158.html,Hokubee Úc Thăn ngoại bò Hokubee Oval 1kg,JENNIE FOOD,780000,Đang cập nhật,Không có,Giới thiệu Hokubee Úc Thăn ngoại bò Hokubee Oval 1kg Với sản phẩm tươi sống trọng lượng thực tế có thể chênh lệch khoảng 10 Bò HOKUBEE được sử dụng theo công nghệ massage và quy trình nuôi chăm sóc cực kỳ nghiêm ngặt theo tiêu chuẩn chăm sóc bò Kobe tại Nhật Điểm đặc trưng của bò Hokubee là sự xen kẽ hoàn hảo giữa lớp thịt và lớp mỡ trên miếng thịt bò tạo nên những hình vân cẩm thạch rất là đẹp mắt Thịt mềm tan chảy khi thưởng thức mà không hề bị khô hay có mùi hôi từ vân mỡ Món ăn rất hợp để làm steak nướng theo gia vị nhẹ nhàng để có thể tận hưởng trọn miếng bò tan chảy tuyệt đỉnh đối 
