Link,Tên sản phẩm,Cửa hàng,Giá bán,Trạng thái,Kho hàng,Mô tả sản phẩm
https://vinmart.co/ba-chi-bo-my-5g-500g-giao-hang-hoa-toc-s23114102715.html,Ba chỉ bò Mỹ 5G 500g Giao hàng hỏa tốc ,FUN FOOD,82500,Còn hàng,Hà Nội,Giới thiệu Ba chỉ bò Mỹ 5G 500g Giao hàng hỏa tốc Ba chỉ Bò Mỹ phần thịt với những dải thịt nạc và thịt mỡ xen kẽ nhau ăn ko hề ngấy mà có độ mềm ngậy ngọt thơm Chế biến đơn giản mà cực ngon Nướng Thả lẩu Cuộn cải xanh nướng cuộn nấm kim châm nướng Ba chỉ bò mỹ bachỉbò Loai 1 như hình Trọng lượng 500g Lạnh rồi nên là các mặt hàng khan hiếm và giá cao nhưng nhà e vẫn giữ giá tốt nha vì đã ôm hàng trước đó Hàng loại 1 như hình Em chưa lấy hàng loại 2 ai thích loại 2 báo em để e lấy về nhé ba_chỉ_bò_Mỹ ba_chỉ_bò_úc ba_chỉ_bò_canada ba_chỉ_bò_thả_lẩu
https://vinmart.co/bo-vien-gan-nha-lam-1kg-l1542430088.html,Bò Viên Gân Nhà Làm 1kg ,THUC PHAM H&H,145000,Còn hàng,Không có,Giới thiệu Bò Viên Gân Nhà Làm 1kg Bò viên gân nhà làm Đóng gói 500g Bò viên được biết đến là món ăn rất ngon miệng và phù hợp khi dùng để nấu phở mì Nhắc đến bò viên thì hầu như ai cũng đã biết đến và cũng đều đã ăn qua Viên bò giòn và dai dai khi ăn vào cảm giác sựt sựt rất ngon Dù là nấu hủ tiếu bún hay phở thì khi có vài viên bò viên thì thật tuyệt vời phải không nào Thật tuyệt vời hơn với cách làm bò viên được lấy từ loại thịt có chút gân và mỡ thì món ăn này sẽ ngon hơn rất nhiều trong khi đó giá thành của chúng cũng không quá đắt 
https://vinmart.co/than-bo-my-khay-500g-l1643398923.html,Thăn Bò Mỹ khay 500g ,NTP Shop's,160000,Còn hàng,Không có,Giới thiệu Thăn Bò Mỹ khay 500g 
https://vinmart.co/cha-gio-tom-thit-dac-biet-15-cay-l1672736372.html, Chả Giò Tôm Thịt Đặc Biệt 15 cây,Tiệm Bánh Mr Bee,156000,Còn hàng,Không có,Giới thiệu Chả Giò Tôm Thịt Đặc Biệt 15 cây Thành phần Tôm thịt heo bánh bía khoai môn sắn nấm mèo hành tiêu tỏi gia vị Quy cách Đóng hộp Bảo quản cấp đông Cam kết Tươi ngon đảm bảo an toàn vệ sinh thực phẩm Cách chế biến Chiên
https://vinmart.co/chan-ga-co-xuong-1kg-l1693439288.html,Chân Gà Có Xương 1kg,THUC PHAM H&H,100000,Còn hàng,Không có,Giới thiệu Chân Gà Có Xương 1kg Chân Gà Có Xương loại to 1kg 20 chân Đóng gói vỉ 1kg Bảo quản ngăn đông Chân gà là món ăn khoái khẩu của nhiều người và được biết đến với vô số cách chế biến khác nhau Chân gà rang muối Chân gà ngâm sả tắ Chân gà sốt cay Hàn Quốc Chân Gà Nướng 
https://vinmart.co/sot-me-rang-kewpie-1l-l1577187472.html,SỐT MÈ RANG KEWPIE 1l,Quầy Ký,195000,Còn hàng,Không có,Giới thiệu SỐT MÈ RANG KEWPIE 1l SỐT MÈ RANG KEWPIE 1l Nước xốt có hương vị đặc trưng đến từ sự kết hợp hài hòa giữa vị ngon bùi của mè rang vị đậm đà của nước tương và vị thanh chua của giấm Thích hợp với các món gà chiên giòn gà hấp và các món gỏi trộn salad Nhãn hiệu Kewpie Xuất xứ thương hiệu Nhật Bản Xuất xứ Việt Nam Quy cách đóng gói 12 chai thùng 9 chai thùng hợp vệ sinh an toàn thực phẩm Thể tích thực 500 ml 1000 ml Thành phần Dầu đậu nành Nước Đường Nước tương Giấm Mè 5 Dầu mè 2 Lòng đỏ trứng gà Muối Chất điều vị 621 Chiết xuất men Chất làm dày 415 Hương mè tổng hợp Chất bảo quản 202 385 Chiết xuất hạt mù tạt Sản phẩm này sử dụng nguyên liệu chứa các thành phần có thể gây dị ứng Lúa mì Trứng Đậu nành Mè Hướng dẫn sử dụng Dùng để chế biến các món ăn làm nước xốt ăn kèm với các món salad thịt nướng hoặc hải sản Sử dụng trong vòng 1 tháng sau khi mở nắp Hướng dẫn bảo quản Để nơi khô ráo thoáng mát tránh ánh nắng trực tiếp Không làm đông lạnh Sau khi mở đậy nắp chặt và giữ lạnh sau khi dùng Cửa hàng Chợ Hoà Bình Địa chỉ cổng chính chợ Hoà Bình đường Bùi Hữu Nghĩa Phường 5 Quận 5 TP HCM Chuyên cung cấp số lượng lớn cho nhà hàng quán ăn Chuyên cung cấp các mặt hàng trung hoa Ship các tỉnh qua chành xe nhà xe khi mua với số lượng lớn Quầy ký có Zalo hỗ trợ 24 24 Liên hệ báo giá sỉ anh Duy SỐT MÈ RANG KEWPIE 1l Nước xốt có hương vị đặc trưng đến từ sự kết hợp hài hòa giữa vị ngon bùi của mè rang vị đậm đà của nước tương và vị thanh chua của giấm Thích hợp với các món gà chiên giòn gà hấp và các món gỏi trộn salad Nhãn hiệu Kewpie Xuất xứ thương hiệu Nhật Bản Xuất xứ Việt Nam Quy cách đóng gói 12 chai thùng 9 chai thùng hợp vệ sinh an toàn thực phẩm Thể tích thực 500 ml 1000 ml Thành phần Dầu đậu nành Nước Đường Nước tương Giấm Mè 5 Dầu mè 2 Lòng đỏ trứng gà Muối Chất điều vị 621 Chiết xuất men Chất làm dày 415 Hương mè tổng hợp Chất bảo quản 202 385 Chiết xuất hạt mù tạt Sản phẩm này sử dụng nguyên liệu chứa các thành phần có thể gây dị ứng Lúa mì Trứng Đậu nành Mè Hướng dẫn sử dụng Dùng để chế biến các món ăn làm nước xốt ăn kèm với các món salad thịt nướng hoặc hải sản Sử dụng trong vòng 1 tháng sau khi mở nắp Hướng dẫn bảo quản Để nơi khô ráo thoáng mát tránh ánh nắng trực tiếp Không làm đông lạnh Sau khi mở đậy nắp chặt và giữ lạnh sau khi dùng Cửa hàng Chợ Hoà Bình Địa chỉ cổng chính chợ Hoà Bình đường Bùi Hữu Nghĩa Phường 5 Quận 5 TP HCM Chuyên cung cấp số lượng lớn cho nhà hàng quán ăn Chuyên cung cấp các mặt hàng trung hoa Ship các tỉnh qua chành xe nhà xe khi mua với số lượng lớn Quầy ký có Zalo hỗ trợ 24 24 Liên hệ báo giá sỉ anh Duy 
https://vinmart.co/thit-bap-loi-bo-hoa-1kg-thit-bap-hoa-bo-tuoi-ngon-bap-bo-mem-ngot-an-la-me-bap-bo-hoa-dong-khay-1kg-l1851944737.html,Thịt Bắp Lõi Bò Hoa 1Kg Thịt Bắp Hoa Bò Tươi Ngon Bắp Bò Mềm Ngọt Ăn Là Mê Bắp Bò Hoa Đóng Khay 1Kg,doanvat165thaiha,145000,Đang cập nhật,Không có,Giới thiệu Thịt Bắp Lõi Bò Hoa 1Kg Thịt Bắp Hoa Bò Tươi Ngon Bắp Bò Mềm Ngọt Ăn Là Mê Bắp Bò Hoa Đóng Khay 1Kg MÔ TẢ SẢN PHẨM THỊT BẮP BÒ NGUYÊN MIẾNG CHẾ BIẾN TÙY THÍCH 1kg Thịt bắp bò ăn mềm ngọt lại giòn nên đã ăn chỉ có nghiền Bảo quản Thịt bắp cấp đông khi chưa sử dụng ngay Rã đông trước khi chế biến Bắp lõi bò có thể chế biến nhiều món như thịt bò Kho gừng thịt bò bắp Ngâm mắm bò Xào cần tỏi bò Nấu sốt vang bắp bò Luộc chấm tương Nấu phở xào phở BẮP BÒ THÁI SẴN TIỆN LỢI Bắp thái sẵn rất phù hợp để ăn lẩu Ngoài nhúng thả lẩu bắpcó thể xào nấu phở vừa ngon vừa rẻ lại ko bị ngấy như ba chỉ
https://vinmart.co/nuoc-mam-hanh-phuc-50ml-vi-10-chai-l1577203373.html,Nước mắm Hạnh Phúc 50ml vỉ 10 chai,Quầy Ký,170000,Còn hàng,Không có,Giới thiệu Nước mắm Hạnh Phúc 50ml vỉ 10 chai Nước mắm Hạnh Phúc 50ml vỉ 10 chai Nước mắm nguyên liệu Công đoạn kiểm tra nguyên liệu Tỉ lệ đạm amin so với đạm toàn phần 50 Công đoạn cô Trong vòng 30 phút nhiệt độ nâng dần lên 60 oC áp suất cô hạ dần xuống 550 650mmHg Sau đó giữ ở điều kiện nêu trên trong 8 20 giờ Công đoạn giải nhiệt Nước mắm đã cô được cho đi qua lần lượt ít 4 bồn nước giải nhiệt có nhiệt độ hạ dần từ 50 xuống 25o C Công đoạn lọc Nước mắm đã được giải nhiệt được cho đi qua lần lượt ít 4 màng lọc có kích thước lỗ lọc giảm dần từ 50µm xuống 0 5µm Đặc tính sản phẩm Màu nâu đỏ cánh gián trong suốt mùi thơm nhẹ vị đậm đà 50ml x 10 chai x 10 lốc thùng Cửa hàng Chợ Hoà Bình Địa chỉ cổng chính chợ Hoà Bình đường Bùi Hữu Nghĩa Phường 5 Quận 5 TP HCM Chuyên cung cấp số lượng lớn cho nhà hàng quán ăn Chuyên cung cấp các mặt hàng trung hoa Ship các tỉnh qua chành xe nhà xe khi mua với số lượng lớn Quầy ký có Zalo hỗ trợ 24 24 Liên hệ báo giá sỉ anh Duy Nước mắm Hạnh Phúc 50ml vỉ 10 chai Nước mắm nguyên liệu Công đoạn kiểm tra nguyên liệu Tỉ lệ đạm amin so với đạm toàn phần 50 Công đoạn cô Trong vòng 30 phút nhiệt độ nâng dần lên 60 oC áp suất cô hạ dần xuống 550 650mmHg Sau đó giữ ở điều kiện nêu trên trong 8 20 giờ Công đoạn giải nhiệt Nước mắm đã cô được cho đi qua lần lượt ít 4 bồn nước giải nhiệt có nhiệt độ hạ dần từ 50 xuống 25o C Công đoạn lọc Nước mắm đã được giải nhiệt được cho đi qua lần lượt ít 4 màng lọc có kích thước lỗ lọc giảm dần từ 50µm xuống 0 5µm Đặc tính sản phẩm Màu nâu đỏ cánh gián trong suốt mùi thơm nhẹ vị đậm đà 50ml x 10 chai x 10 lốc thùng Cửa hàng Chợ Hoà Bình Địa chỉ cổng chính chợ Hoà Bình đường Bùi Hữu Nghĩa Phường 5 Quận 5 TP HCM Chuyên cung cấp số lượng lớn cho nhà hàng quán ăn Chuyên cung cấp các mặt hàng trung hoa Ship các tỉnh qua chành xe nhà xe khi mua với số lượng lớn Quầy ký có Zalo hỗ trợ 24 24 Liên hệ báo giá sỉ anh Duy 
https://vinmart.co/kho-ca-cac-loai-l1603791637.html,Khô cá các loại,Chuyên cung cấp cá khô,50000,Đang cập nhật,Không có,Giới thiệu Khô cá các loại
https://vinmart.co/top-mo-lien-da-mam-hanh-250g-anvat492-l1852384179.html,Top Mỡ Liền Da Mắm Hành 250g ANVAT492,Ăn vặt 492,69900,Còn hàng,Không có,Giới thiệu Top Mỡ Liền Da Mắm Hành 250g ANVAT492 TÓP MỠ LIỀN DA SỐT MẮM HÀNH Thơm lừng cay cay mặn mặn ngọt ngọt thấm đều từng miếng Tóp mỡ được nhà em gia công không khác gì tóp heo quay đâu nhen bà con Siêu giòn xốp ráo dầu Gia vị thấm đều từng miếng Khách ăn vặt hay ăn cơm gì cũng ngon tóp giòn rụm kết hợp cùng tỏi phi cháy cay cay món ăn vô cùng hấp dẫn Các trường hợp đổi trả Hàng lỗi hư mốc Lỗi nhầm mẫu Lỗi sơ sót thiếu sản phẩm các bạn liên hệ shop để được đổi lại trường hợp thiếu hàng các bạn cung cấp clip quay bóc sản phẩm nhé TÓP MỠ LIỀN DA SỐT MẮM HÀNH Thơm lừng cay cay mặn mặn ngọt ngọt thấm đều từng miếng Tóp mỡ được nhà em gia công không khác gì tóp heo quay đâu nhen bà con Siêu giòn xốp ráo dầu Gia vị thấm đều từng miếng Khách ăn vặt hay ăn cơm gì cũng ngon tóp giòn rụm kết hợp cùng tỏi phi cháy cay cay món ăn vô cùng hấp dẫn Các trường hợp đổi trả Hàng lỗi hư mốc Lỗi nhầm mẫu Lỗi sơ sót thiếu sản phẩm các bạn liên hệ shop để được đổi lại trường hợp thiếu hàng các bạn cung cấp clip quay bóc sản phẩm nhé 
https://vinmart.co/1kg-nem-nuong-nha-trang-hoa-toc-l1878617718.html,1kg Nem nướng Nha Trang hoả tốc ,Thucphamdonglanh Tiến My,135800,Còn hàng,Không có,Giới thiệu 1kg Nem nướng Nha Trang hoả tốc NEM NƯỚNG NHA TRANG 1kg 2 bịch Ai đã từng đến Nha Trang mà không thể không thử món Nem nướng Nha Trang thử rồi không nghiện mới lạ à nha Được xem là 1 trong những món đặc sản của miền Trung Nem được xiên nướng với bếp than hồng hút chân không Khách về bảo quản ngăn đông đã chín sẵn nên về khách chỉ cần lấy ra trước quay sơ hoặc nướng áp chảo sơ thêm ít bún rau sống dưa leo mắm tỏi là đã có món ngon quê mà không cần phải đặt chân đến Nha Trang mới thưởng thức được 
https://vinmart.co/chan-ga-u-muoi-da-rut-xuong-ship-hcm-l1918673616.html,Chân gà ủ muối đã rút xương ship hcm ,Hàng đông lạnh sg,70000,Còn hàng,Không có,Giới thiệu Chân gà ủ muối đã rút xương ship hcm CHÂN GÀ RÚT XƯƠNG Ủ MUỐI Giòn giòn beo béo thơm gia vị đậm đà ăn một cái muốn ăn cái thứ 2 Hút chân không bảo quản ngăn mát 10 ngày ngăn đông 3 tháng Chân gà chế biến sẵn ăn ngay không phải mất thời gian nấu nướng 80k khay Tặng kèm muối chấm
https://vinmart.co/500gr-lap-xuong-thit-heo-soc-trang-hang-loai-1-l1894688379.html,500gr lạp xưởng thịt heo sóc trăng hàng loại 1,minhbaofood,70000,Còn hàng,Không có,Giới thiệu 500gr lạp xưởng thịt heo sóc trăng hàng loại 1 Lạp xưởng Sóc Trăng được biết đến là đặc sản thơm ngon hấp dẫn dễ chế biến được nhiều du khách gần xa lựa chọn làm quà tặng cho bạn bè người thân lạp xưởng thi t heo của vùng đất Sóc Trăng được làm từ nguyên liệu thịt lợn nạc thịt mỡ gia vị Cộng thêm bí quyết pha trộn nguyên liệu gia truyền của các cơ sở sản xuất và tâm huyết của người làm ra món lạp xưởng danh tiếng 
https://vinmart.co/1-cai-chan-gio-heo-truoc-2kg-thit-heo-tuoi-nong-tan-giau-food-hcm-l1453145436.html,1 Cái Chân Giò Heo Trước 2Kg Thịt Heo Tươi Nóng Tân Giàu Food HCM,Thịt Heo Tươi Nóng - Tân Giàu Food,186000,Còn hàng,Không có,Giới thiệu 1 Cái Chân Giò Heo Trước 2Kg Thịt Heo Tươi Nóng Tân Giàu Food HCM Thịt lợn hay thịt heo là phần cơ của con lợn Đây là một loại thực phẩm được xem là lành nhất trong các loại thực phẩm thịt heo rất phổ biến trong bữa cơm gi Hiện nay TÂN GIÀU FOOD bán đầy đủ các chủng loại mặt hàng thịt heo giúp người tiêu dùng dễ dàng lựa chọn cho gia đình mình những khúc thịt tươi ngon đảm bảo chất lượng giá cả lại phù hợp để chế biến thành các món ăn thơm ngon và đầy dinh dưỡng trong bữa cơm gia đình Đối với mặt hàng thịt heo TÂN GIÀU FOOD luôn đưa ra các tiêu chí khắt khe trong quá trình nuôi nhốt đến giết mổ và phân phối đến người tiêu dùng cụ thể yêu cầu Nguồn nguyên liệu Đàn heo được lựa chọn kỹ càng từ trại chăn nuôi Heo đưa vào giết mổ phải là heo khỏe mạnh tuyệt đối không có mầm bệnh Trước khi đưa vào giết mổ heo được nghỉ ngơi trong thời gian ngắn vài tiếng để chất lượng thịt heo sau khi giết mổ đạt chất lượng cao nhất Sau khi giết mổ heo bên đều được Cơ quan thú y nhà nước kiểm tra đóng dấu trước khi đưa ra thị trường tiêu thụ Hệ thống kiểm soát Heo luôn được kiểm soát từ khâu nuôi nhốt đến khi giết mổ bởi Cục thú y Trung tâm thú y TPHCM và Chi cục thú y địa phương Dây chuyền giết mổ Được cơ quan kiểm định độc lập kiểm tra và cấp phép giết mổ theo yêu cầu của UBND TPHCM Quy trình giết mổ pha lóc và bảo quản thịt heo Luôn được đặt dưới sự kiểm soát chặt chẽ của Chi cục thú y TPHCM Thịt heo được phân phối đến các hệ thống bán lẻ ở nhiệt độ mát nhằm đảm bảo điều kiện vệ sinh tốt nhất cho sản phẩm giúp người tiêu dùng mua được sản phẩm đạt chất lượng 
https://vinmart.co/nem-chua-ca-thac-lac-dac-san-campuchia-xau-100-vien-giao-tphcm-l1711874359.html,Nem chua cá thác lác đặc sản campuchia xâu 100 viên giao tphcm ,Tạp Hóa Mỹ Kỳ,95000,Còn hàng,Không có,Giới thiệu Nem chua cá thác lác đặc sản campuchia xâu 100 viên giao tphcm Nem chua cá thác lác Đặc sản campuchia chín sẵn mua về mở bịt là ăn nha 100k 1xâu 100 viên Nem làm rất kì công từ 100 cá thát lát gia vị tiêu ớt hiểm K chất bảo quản và phụ gia Chua chua ngọt ngọt Ớt hiểm muối rồi ko cay lắm nha Bóc ăn luôn hoặc rán nướng qua chấm tương khỏi bàn luôn ạ Bảo quản ngăn đông cả năm luôn cũng đc NGON ĐỘC LẠ RẺ Hương vị Chua chua ngọt ngọt cay cay thơm thơm dai dai vị cá thác lác Kích cỡ Bằng cỡ củ tỏi cô đơn Đánh giá Lạ miệng và ngon Bảo quản ngăn đông tủ lạnh để nem ko chua thêm Nguồn gốc Campuchia 
https://vinmart.co/kho-ca-com-than-500g-dac-san-que-bien-phan-rang-l1478386768.html,Khô Cá Cơm Than 500g Đặc Sản Quê Biên Phan Rang,congdophanrang,230000,Còn hàng,Không có,Giới thiệu Khô Cá Cơm Than 500g Đặc Sản Quê Biên Phan Rang Khô Cá Cơm Than 500g Đặc Sản Quê Biên Phan Rang Cá cơm khô là Đặc sản Đà Nẵng làm quà vô cùng hấp dẫn cho bạn và người thân những món ăn từ nó đem lại hương vị mặn mà của miền biển và vô cùng hấp dẫn trong mỗi bữa cơm Các món ăn tuyệt vời với Cá cơm khôcá cơm khôCá cơm khô chiên mắmNhững chú ý khi chế biếnCá cơm khô thường mặn vì trong quá trình phơi sấy người sản xuất phải ướp thêm một lượng muối vừa đủ Bạn hãy giảm độ mặn trong cá bằng cách ngâm trong nước chanh loãng từ 5 10 phút trước khi chế biến ngoài ra khi ngâm cá còn làm cá mềm hơn Khi chế biến hãy chiên cá trên chảo dầu cho vàng đều để Cá giữ được hương vị riêng sau đó mới thêm gia vị Cá rất nhanh chín vì thế bạn hãy để nhỏ lửa và nêm đường nhiều hơn muối Vào mùa mưa mùa lạnh các món được làm từ Cá cơm khô là món ăn rất tuyệt vời khi ăn cùng cơm nóng như Kho quẹt Rim mắm Rim tỏi ớt Kho thịt Ba chỉ Quy trình đánh bắt và phơi Cá cơm tươi sau khi đánh bắt đem rửa sạch Ngâm vào nước muối pha loãng để cá có độ mặn sẽ bảo quản lâu hơn Hấp chín Phơi nắng Cá chỉ cần phơi 1 ngày dưới nắng gắt là đạt yêu cầu Cách bảo quảnCá được bỏ vào túi hộp kín để ở nơi khô thoáng vào mùa nắng khoảng 4 tuần mùa mưa thì 2 3 tuần đem cá ra phơi lại khoảng 1 2h Với cách này có thể bảo quản được đến 6 tháng Nếu được hãy bảo quản Cá ở ngăn đông của tủ lạnh sẽ giữ được lâu hơn nữa ĐẶC SẢN QUÊ BIỂN PHAN RANG CÔNG ĐỖ Kính chào quý khách đã ghé thăm và mua sắm tại Thực Phẩm Quê Biển PHAN RANG Công Đỗ Hệ thống cửa hàng Thực Phẩm Khô Hải Sản Phan Rang có các loại sản phẩm khô mực khô cá chỉ vàng tôm khô Sỉ Nhà Hàng Quán Bia giá tốt H o t l i n e 088 618 2379 Cam kết chất lượng sản phẩm nguyên liệu sạch chế biến sạch Vật liệu đóng gói sạchCơ sở 1 Cảng Đông Hải TP Phan Rang Ninh ThuậnCơ sở 2 139 Nguyễn Thị Sáu Thạnh Lộc Q12 Tp HCM
https://vinmart.co/canh-ga-chay-500gr-giao-hoa-toc-tphcm-s21500928534.html,CÁNH GÀ CHAY 500GR GIAO HOA TỐC TPHCM ,Chay Hồng Phúc,60000,Còn hàng,TP. Hồ Chí Minh,Giới thiệu CÁNH GÀ CHAY 500GR GIAO HOA TỐC TPHCM Đùi Gà Sả Chay Thanh Dũng mang hương vị thơm ngon đặc trưng từ sả hòa quyện với hương vị đậu nành và lúa mì đem đến cho bạn và gia đình bữa ăn ngon miệng và hấp dẫn Bạn có thể sử dụng đùi gà sả chay để chế biến các món ăn tùy ý như chiên kho xào sản phẩm được đóng gói tiện lợi và dể sử dụng Đùi gà sả chay được sản xuất theo quy trình khép kín hợp vệ sinh an toàn thực phẩm không chứa hàn the chất bảo quản và không gây ảnh hưởng đến sức khỏe người tiêu dùng Giúp bạn an tâm chế biến món ăn ưa thích cho cả gia đình Thành phần Bột mì đạm đậu nành sả dầu thực vật muối tiêu đường hạt nêm chay Cách sử dụng Rã đông chiên kho nấu cà ri Bảo quản Đông lạnh nơi có ngăn đông lạnh 18 C Khối lượng tịnh 500g 
https://vinmart.co/nac-dam-heo-meat-master-400g-s15881710651.html,Nạc dăm heo Meat Master 400G ,Meat Master,91200,Còn hàng,"Quận 1, TP. Hồ Chí Minh",Giới thiệu Nạc dăm heo Meat Master 400G Nạc dăm heo là phần thịt nằm ở lõi vai của con heo Miếng thịt nạc có những lớp mỡ mỏng xen không đều nhau không tách ra thành những lớp thịt mỡ rõ ràng Thịt nạc dăm là thịt có phủ lớp mỡ mỏng nên ăn không ngấy như thịt ba rọi ba chỉ và cũng không khô như thịt thăn SẢN PHẨM ĐƯỢC ÁP DỤNG CHO HÌNH THỨC GIAO HÀNG HỎA TỐC ĐẶT ĐIỂM NỔI BẬT NẠC DĂM HEO Với mong muốn mang đến cho mỗi gia đình sản phẩm thịt sạch tươi ngon Thương hiệu thịt mát Meat Master được ra đời dựa trên 3 tiêu chuẩn hoàn hảo đem đến chất lượng cũng như giá trị dinh dưỡng trong mỗi bữa ăn của gia đình bạn Hệ thống chăn nuôi khép kín 3F Feed Farm Food Trang trại của Meat Master hoạt động theo quy trình khép kín từ thức ăn giết mổ và chế biến Thịt heo đạt chuẩn 180 1 ngày 180 ngày chăn nuôi để thịt heo đạt chất lượng cao nhất 1 ngày đóng gói vận chuyển đến điểm phân phối Công nghệ Oxy Fresh Công nghệ này giúp giữ nguyên chất lượng và màu đỏ hồng của thịt tươi trong suốt thời hạn sử dụng hạn chế vi sinh phát triển nhờ cung cấp Oxy tự nhiên vào bên trong hộp thịt Toàn bộ quá trình chế biến đóng gói vận chuyển và phân phối đều đảm bảo nhiệt độ thịt từ 0 đến 4 độ C giúp thịt luôn trong môi trường mát lành tươi ngon THÔNG TIN DINH DƯỠNG NẠC DĂM HEO 100g thịt nạc dăm chứa 17gr Protein 12gr chất béo 8 mg Canxi 1 2 mg Sắt 186 mg Phospho 69mg Natri 324mg Kali 67mg Cholesterol 1 5mg Vitamin C 0 71 mg Vitamin B1 3 9 mg Vitamin PP 6 mg Vitamin A CÁCH CHẾ BIẾN NẠC DĂM HEO Nạc dăm heo có thể làm các món chiên giòn Hàn Quốc nướng xào dứa bún thịt xào cuộn phô mai bún chả Hà Nội Trọng lượng nạc dăm heo 400 G Với sản phẩm tươi sống trọng lượng thực tế có thể chênh lệch khoảng 10 Qui cách đóng gói nạc dăm heo Mỗi khay đều được bọc seal kín và cung cấp Oxy Fresh đảm bảo thịt luôn tươi ngon Hạn sử dụng nạc dăm heo Đã được in rõ trên bao bì Nơi sản xuất nạc dăm heo Việt Nam Xuất xứ thương hiệu nạc dăm heo Hàn Quốc thit heo suonheo suon thitheo thitlon baroi thitxay suonnonheo thitbachi bachiheo thitlonbachi baroiheo thitbachiheo thitbaroi bachilon bachingon bachi suonheongon suonngon meatmaster MeatMaster nacdam nacdamheo nac damheo nacdamlon damlon
https://vinmart.co/xuc-xich-cp-vealz-10-500g-xuc-xich-xong-khoi-cp-goi-10cay-l1708432280.html,XÚC XÍCH CP VEALZ 10 500G xúc xích xông khói CP gói 10cây,ĂN VẶT XIÊN QUE - KIKI SHOP,110000,Còn hàng,Không có,Giới thiệu XÚC XÍCH CP VEALZ 10 500G xúc xích xông khói CP gói 10cây MÔ TẢ SẢN PHẨM Xúc Xích Vealz CP với thành phần nguyên liệu từ thịt heo thịt gà mỡ heo tinh bột muối đường mang lại dinh dưỡng cho cơ thể cung cấp năng lượng cho các hoạt động trong ngày Quy cách đóng gói 10 cây bịch 500gr hoặc 8 cây bịch 500gr Hướng dẫn bảo quản ở nhiệt độ 0 4 độ C Hạn sử dụng 55 ngày 
